11:21:49.018116 IP draculet-ThinkPad-E470c.37802 > 8.12.18.89.vultr.com.9981: Flags [F.], seq 1749958700, ack 1905788626, win 229, options [nop,nop,TS val 510076450 ecr 3045355632], length 0
11:21:49.018153 IP draculet-ThinkPad-E470c.37800 > 8.12.18.89.vultr.com.9981: Flags [F.], seq 1365827879, ack 2921344751, win 229, options [nop,nop,TS val 510076450 ecr 3045355632], length 0
11:21:49.018165 IP draculet-ThinkPad-E470c.37790 > 8.12.18.89.vultr.com.9981: Flags [F.], seq 3504139399, ack 3853295066, win 229, options [nop,nop,TS val 510076450 ecr 3045355632], length 0
11:21:49.018175 IP draculet-ThinkPad-E470c.37628 > 8.12.18.89.vultr.com.9981: Flags [F.], seq 2296133868, ack 4192114183, win 229, options [nop,nop,TS val 510076450 ecr 3045355568], length 0
11:21:49.018184 IP draculet-ThinkPad-E470c.37618 > 8.12.18.89.vultr.com.9981: Flags [F.], seq 3219537222, ack 1014418332, win 229, options [nop,nop,TS val 510076450 ecr 3045355568], length 0
11:21:49.018194 IP draculet-ThinkPad-E470c.37022 > 8.12.18.89.vultr.com.9981: Flags [F.], seq 68464141, ack 835842661, win 229, options [nop,nop,TS val 510076450 ecr 3045355248], length 0
11:21:49.018203 IP draculet-ThinkPad-E470c.37018 > 8.12.18.89.vultr.com.9981: Flags [F.], seq 2598652297, ack 4109823601, win 229, options [nop,nop,TS val 510076450 ecr 3045355248], length 0
11:21:49.018213 IP draculet-ThinkPad-E470c.36996 > 8.12.18.89.vultr.com.9981: Flags [F.], seq 763760810, ack 885566055, win 229, options [nop,nop,TS val 510076450 ecr 3045355248], length 0
11:21:49.018228 IP draculet-ThinkPad-E470c.36924 > 8.12.18.89.vultr.com.9981: Flags [F.], seq 3815154833, ack 4190564098, win 229, options [nop,nop,TS val 510076450 ecr 3045355248], length 0
11:21:49.018239 IP draculet-ThinkPad-E470c.36154 > 8.12.18.89.vultr.com.9981: Flags [F.], seq 1473841689, ack 1742179631, win 229, options [nop,nop,TS val 510076450 ecr 3045355184], length 0
11:21:49.018251 IP draculet-ThinkPad-E470c.36050 > 8.12.18.89.vultr.com.9981: Flags [F.], seq 3985459701, ack 3455151112, win 229, options [nop,nop,TS val 510076450 ecr 3045355184], length 0
11:21:49.018260 IP draculet-ThinkPad-E470c.35676 > 8.12.18.89.vultr.com.9981: Flags [F.], seq 2841597940, ack 668446891, win 229, options [nop,nop,TS val 510076450 ecr 3045355184], length 0
11:21:49.018272 IP draculet-ThinkPad-E470c.38120 > 8.12.18.89.vultr.com.9981: Flags [F.], seq 135471085, ack 1901592557, win 229, options [nop,nop,TS val 510076450 ecr 3045355696], length 0
11:21:49.018285 IP draculet-ThinkPad-E470c.38118 > 8.12.18.89.vultr.com.9981: Flags [F.], seq 2717598989, ack 1882292119, win 229, options [nop,nop,TS val 510076450 ecr 3045355696], length 0
11:21:49.018295 IP draculet-ThinkPad-E470c.37860 > 8.12.18.89.vultr.com.9981: Flags [F.], seq 4236823948, ack 746266281, win 229, options [nop,nop,TS val 510076450 ecr 3045355632], length 0
11:21:49.018305 IP draculet-ThinkPad-E470c.35472 > 8.12.18.89.vultr.com.9981: Flags [F.], seq 3200048393, ack 754422157, win 229, options [nop,nop,TS val 510076450 ecr 3045355120], length 0
11:21:49.018317 IP draculet-ThinkPad-E470c.39330 > 8.12.18.89.vultr.com.9981: Flags [F.], seq 85601757, ack 1461233201, win 229, options [nop,nop,TS val 510076450 ecr 3045355824], length 0
11:21:49.018328 IP draculet-ThinkPad-E470c.39266 > 8.12.18.89.vultr.com.9981: Flags [F.], seq 2513590632, ack 1551113712, win 229, options [nop,nop,TS val 510076450 ecr 3045355824], length 0
11:21:49.018341 IP draculet-ThinkPad-E470c.39248 > 8.12.18.89.vultr.com.9981: Flags [F.], seq 3057256432, ack 2999549645, win 229, options [nop,nop,TS val 510076450 ecr 3045355824], length 0
11:21:49.018352 IP draculet-ThinkPad-E470c.39220 > 8.12.18.89.vultr.com.9981: Flags [F.], seq 1155939606, ack 1272368557, win 229, options [nop,nop,TS val 510076450 ecr 3045355824], length 0
11:21:49.018363 IP draculet-ThinkPad-E470c.38700 > 8.12.18.89.vultr.com.9981: Flags [F.], seq 782236591, ack 4115153844, win 229, options [nop,nop,TS val 510076450 ecr 3045355760], length 0
11:21:49.018373 IP draculet-ThinkPad-E470c.38690 > 8.12.18.89.vultr.com.9981: Flags [F.], seq 2632751775, ack 2436373779, win 229, options [nop,nop,TS val 510076450 ecr 3045355760], length 0
11:21:49.018394 IP draculet-ThinkPad-E470c.38656 > 8.12.18.89.vultr.com.9981: Flags [F.], seq 3045742980, ack 777463090, win 229, options [nop,nop,TS val 510076450 ecr 3045355760], length 0
11:21:49.018404 IP draculet-ThinkPad-E470c.38654 > 8.12.18.89.vultr.com.9981: Flags [F.], seq 768772472, ack 3474674992, win 229, options [nop,nop,TS val 510076450 ecr 3045355760], length 0
11:21:49.018413 IP draculet-ThinkPad-E470c.38260 > 8.12.18.89.vultr.com.9981: Flags [F.], seq 3950479901, ack 255886813, win 229, options [nop,nop,TS val 510076450 ecr 3045355696], length 0
11:21:49.018427 IP draculet-ThinkPad-E470c.39472 > 8.12.18.89.vultr.com.9981: Flags [F.], seq 2513064964, ack 1154180495, win 229, options [nop,nop,TS val 510076450 ecr 3045355824], length 0
11:21:49.018439 IP draculet-ThinkPad-E470c.39454 > 8.12.18.89.vultr.com.9981: Flags [F.], seq 3843114028, ack 2903291482, win 229, options [nop,nop,TS val 510076450 ecr 3045355824], length 0
11:21:49.018449 IP draculet-ThinkPad-E470c.39386 > 8.12.18.89.vultr.com.9981: Flags [F.], seq 1770516692, ack 2264513436, win 229, options [nop,nop,TS val 510076450 ecr 3045355824], length 0
11:21:49.018464 IP draculet-ThinkPad-E470c.39368 > 8.12.18.89.vultr.com.9981: Flags [F.], seq 1812475931, ack 2561281166, win 229, options [nop,nop,TS val 510076450 ecr 3045355824], length 0
11:21:49.018474 IP draculet-ThinkPad-E470c.39164 > 8.12.18.89.vultr.com.9981: Flags [F.], seq 2092444898, ack 2729179655, win 229, options [nop,nop,TS val 510076450 ecr 3045355824], length 0
11:21:49.018485 IP draculet-ThinkPad-E470c.39096 > 8.12.18.89.vultr.com.9981: Flags [F.], seq 811086399, ack 1141666209, win 229, options [nop,nop,TS val 510076450 ecr 3045355760], length 0
11:21:49.018494 IP draculet-ThinkPad-E470c.38910 > 8.12.18.89.vultr.com.9981: Flags [F.], seq 2686599743, ack 735202008, win 229, options [nop,nop,TS val 510076450 ecr 3045355760], length 0
11:21:49.018506 IP draculet-ThinkPad-E470c.38870 > 8.12.18.89.vultr.com.9981: Flags [F.], seq 1940701185, ack 4198702985, win 229, options [nop,nop,TS val 510076450 ecr 3045355760], length 0
11:21:49.018514 IP draculet-ThinkPad-E470c.38850 > 8.12.18.89.vultr.com.9981: Flags [F.], seq 1037116891, ack 1496060519, win 229, options [nop,nop,TS val 510076450 ecr 3045355760], length 0
11:21:49.018525 IP draculet-ThinkPad-E470c.38838 > 8.12.18.89.vultr.com.9981: Flags [F.], seq 1662568793, ack 2061960020, win 229, options [nop,nop,TS val 510076450 ecr 3045355760], length 0
11:21:49.018536 IP draculet-ThinkPad-E470c.38780 > 8.12.18.89.vultr.com.9981: Flags [F.], seq 2485612804, ack 3747530023, win 229, options [nop,nop,TS val 510076450 ecr 3045355760], length 0
11:21:49.018549 IP draculet-ThinkPad-E470c.38764 > 8.12.18.89.vultr.com.9981: Flags [F.], seq 3053989559, ack 241649135, win 229, options [nop,nop,TS val 510076450 ecr 3045355760], length 0
11:21:49.018559 IP draculet-ThinkPad-E470c.38762 > 8.12.18.89.vultr.com.9981: Flags [F.], seq 887755955, ack 3691142879, win 229, options [nop,nop,TS val 510076450 ecr 3045355760], length 0
11:21:49.018569 IP draculet-ThinkPad-E470c.38468 > 8.12.18.89.vultr.com.9981: Flags [F.], seq 1915662335, ack 2091903638, win 229, options [nop,nop,TS val 510076450 ecr 3045355696], length 0
11:21:49.018579 IP draculet-ThinkPad-E470c.37432 > 8.12.18.89.vultr.com.9981: Flags [F.], seq 2020339016, ack 2265761580, win 229, options [nop,nop,TS val 510076450 ecr 3045355312], length 0
11:21:49.018591 IP draculet-ThinkPad-E470c.37368 > 8.12.18.89.vultr.com.9981: Flags [F.], seq 3255742389, ack 163429746, win 229, options [nop,nop,TS val 510076450 ecr 3045355248], length 0
11:21:49.018600 IP draculet-ThinkPad-E470c.36884 > 8.12.18.89.vultr.com.9981: Flags [F.], seq 3028604677, ack 3914588606, win 229, options [nop,nop,TS val 510076450 ecr 3045355248], length 0
11:21:49.018610 IP draculet-ThinkPad-E470c.36852 > 8.12.18.89.vultr.com.9981: Flags [F.], seq 4211865187, ack 1131439366, win 229, options [nop,nop,TS val 510076450 ecr 3045355248], length 0
11:21:49.018621 IP draculet-ThinkPad-E470c.36596 > 8.12.18.89.vultr.com.9981: Flags [F.], seq 815648066, ack 60922607, win 229, options [nop,nop,TS val 510076450 ecr 3045355248], length 0
11:21:49.018631 IP draculet-ThinkPad-E470c.37230 > 8.12.18.89.vultr.com.9981: Flags [F.], seq 617618603, ack 1530055388, win 229, options [nop,nop,TS val 510076450 ecr 3045355312], length 0
11:21:49.018641 IP draculet-ThinkPad-E470c.37152 > 8.12.18.89.vultr.com.9981: Flags [F.], seq 743163388, ack 1459098102, win 229, options [nop,nop,TS val 510076450 ecr 3045355312], length 0
11:21:49.018652 IP draculet-ThinkPad-E470c.33922 > 8.12.18.89.vultr.com.9981: Flags [F.], seq 3035383478, ack 2117157066, win 229, options [nop,nop,TS val 510076450 ecr 3045353712], length 0
11:21:49.018662 IP draculet-ThinkPad-E470c.33654 > 8.12.18.89.vultr.com.9981: Flags [F.], seq 4173423316, ack 1112578249, win 229, options [nop,nop,TS val 510076450 ecr 3045353712], length 0
11:21:49.018673 IP draculet-ThinkPad-E470c.34900 > 8.12.18.89.vultr.com.9981: Flags [F.], seq 3285006985, ack 451125951, win 229, options [nop,nop,TS val 510076450 ecr 3045353776], length 0
11:21:49.018685 IP draculet-ThinkPad-E470c.34898 > 8.12.18.89.vultr.com.9981: Flags [F.], seq 2745012970, ack 1699302688, win 229, options [nop,nop,TS val 510076450 ecr 3045353776], length 0
11:21:49.018695 IP draculet-ThinkPad-E470c.34698 > 8.12.18.89.vultr.com.9981: Flags [F.], seq 232738394, ack 2389439799, win 229, options [nop,nop,TS val 510076450 ecr 3045353776], length 0
11:21:49.018705 IP draculet-ThinkPad-E470c.39528 > 8.12.18.89.vultr.com.9981: Flags [F.], seq 3098517007, ack 2227567446, win 229, options [nop,nop,TS val 510076450 ecr 3045357488], length 0
11:21:49.018717 IP draculet-ThinkPad-E470c.39526 > 8.12.18.89.vultr.com.9981: Flags [F.], seq 3201678883, ack 1757099316, win 229, options [nop,nop,TS val 510076450 ecr 3045357488], length 0
11:21:49.018728 IP draculet-ThinkPad-E470c.39524 > 8.12.18.89.vultr.com.9981: Flags [F.], seq 2827188962, ack 3827450216, win 229, options [nop,nop,TS val 510076450 ecr 3045357488], length 0
11:21:49.018746 IP draculet-ThinkPad-E470c.39522 > 8.12.18.89.vultr.com.9981: Flags [F.], seq 2805135347, ack 2555219315, win 229, options [nop,nop,TS val 510076450 ecr 3045357488], length 0
11:21:49.018762 IP draculet-ThinkPad-E470c.39520 > 8.12.18.89.vultr.com.9981: Flags [F.], seq 2718135885, ack 3528131650, win 229, options [nop,nop,TS val 510076450 ecr 3045357488], length 0
11:21:49.018776 IP draculet-ThinkPad-E470c.39518 > 8.12.18.89.vultr.com.9981: Flags [F.], seq 1659793178, ack 1087583948, win 229, options [nop,nop,TS val 510076450 ecr 3045357488], length 0
11:21:49.018786 IP draculet-ThinkPad-E470c.39516 > 8.12.18.89.vultr.com.9981: Flags [F.], seq 3887579660, ack 652484306, win 229, options [nop,nop,TS val 510076450 ecr 3045357488], length 0
11:21:49.018796 IP draculet-ThinkPad-E470c.39514 > 8.12.18.89.vultr.com.9981: Flags [F.], seq 210909358, ack 2404462223, win 229, options [nop,nop,TS val 510076450 ecr 3045357488], length 0
11:21:49.018806 IP draculet-ThinkPad-E470c.39512 > 8.12.18.89.vultr.com.9981: Flags [F.], seq 2751728639, ack 4116610039, win 229, options [nop,nop,TS val 510076450 ecr 3045357488], length 0
11:21:49.018816 IP draculet-ThinkPad-E470c.39510 > 8.12.18.89.vultr.com.9981: Flags [F.], seq 903255268, ack 3149659559, win 229, options [nop,nop,TS val 510076450 ecr 3045357488], length 0
11:21:49.018826 IP draculet-ThinkPad-E470c.39508 > 8.12.18.89.vultr.com.9981: Flags [F.], seq 4048439453, ack 1794358064, win 229, options [nop,nop,TS val 510076450 ecr 3045357488], length 0
11:21:49.018836 IP draculet-ThinkPad-E470c.39506 > 8.12.18.89.vultr.com.9981: Flags [F.], seq 3408273110, ack 1830683304, win 229, options [nop,nop,TS val 510076450 ecr 3045357488], length 0
11:21:49.018846 IP draculet-ThinkPad-E470c.39502 > 8.12.18.89.vultr.com.9981: Flags [F.], seq 615570228, ack 4269789138, win 229, options [nop,nop,TS val 510076450 ecr 3045357488], length 0
11:21:49.018856 IP draculet-ThinkPad-E470c.39500 > 8.12.18.89.vultr.com.9981: Flags [F.], seq 1913023658, ack 1220361522, win 229, options [nop,nop,TS val 510076450 ecr 3045357488], length 0
11:21:49.309227 IP draculet-ThinkPad-E470c.39530 > 8.12.18.89.vultr.com.9981: Flags [S], seq 3323604420, win 29200, options [mss 1460,sackOK,TS val 510076522 ecr 0,nop,wscale 7], length 0
11:21:49.309261 IP draculet-ThinkPad-E470c.39532 > 8.12.18.89.vultr.com.9981: Flags [S], seq 1652432900, win 29200, options [mss 1460,sackOK,TS val 510076522 ecr 0,nop,wscale 7], length 0
11:21:49.309316 IP draculet-ThinkPad-E470c.39536 > 8.12.18.89.vultr.com.9981: Flags [S], seq 538332129, win 29200, options [mss 1460,sackOK,TS val 510076522 ecr 0,nop,wscale 7], length 0
11:21:49.309325 IP draculet-ThinkPad-E470c.39534 > 8.12.18.89.vultr.com.9981: Flags [S], seq 3645422596, win 29200, options [mss 1460,sackOK,TS val 510076522 ecr 0,nop,wscale 7], length 0
11:21:49.309366 IP draculet-ThinkPad-E470c.39538 > 8.12.18.89.vultr.com.9981: Flags [S], seq 4146789889, win 29200, options [mss 1460,sackOK,TS val 510076522 ecr 0,nop,wscale 7], length 0
11:21:49.309433 IP draculet-ThinkPad-E470c.39540 > 8.12.18.89.vultr.com.9981: Flags [S], seq 2975248860, win 29200, options [mss 1460,sackOK,TS val 510076522 ecr 0,nop,wscale 7], length 0
11:21:49.309525 IP draculet-ThinkPad-E470c.39542 > 8.12.18.89.vultr.com.9981: Flags [S], seq 3398791553, win 29200, options [mss 1460,sackOK,TS val 510076522 ecr 0,nop,wscale 7], length 0
11:21:49.309569 IP draculet-ThinkPad-E470c.39544 > 8.12.18.89.vultr.com.9981: Flags [S], seq 222562721, win 29200, options [mss 1460,sackOK,TS val 510076522 ecr 0,nop,wscale 7], length 0
11:21:49.309663 IP draculet-ThinkPad-E470c.39546 > 8.12.18.89.vultr.com.9981: Flags [S], seq 3139960414, win 29200, options [mss 1460,sackOK,TS val 510076522 ecr 0,nop,wscale 7], length 0
11:21:49.309705 IP draculet-ThinkPad-E470c.39548 > 8.12.18.89.vultr.com.9981: Flags [S], seq 3721096595, win 29200, options [mss 1460,sackOK,TS val 510076522 ecr 0,nop,wscale 7], length 0
11:21:49.309746 IP draculet-ThinkPad-E470c.39550 > 8.12.18.89.vultr.com.9981: Flags [S], seq 2093877451, win 29200, options [mss 1460,sackOK,TS val 510076522 ecr 0,nop,wscale 7], length 0
11:21:49.309837 IP draculet-ThinkPad-E470c.39552 > 8.12.18.89.vultr.com.9981: Flags [S], seq 1425774909, win 29200, options [mss 1460,sackOK,TS val 510076522 ecr 0,nop,wscale 7], length 0
11:21:49.309879 IP draculet-ThinkPad-E470c.39554 > 8.12.18.89.vultr.com.9981: Flags [S], seq 551674225, win 29200, options [mss 1460,sackOK,TS val 510076522 ecr 0,nop,wscale 7], length 0
11:21:49.309922 IP draculet-ThinkPad-E470c.39556 > 8.12.18.89.vultr.com.9981: Flags [S], seq 3792690892, win 29200, options [mss 1460,sackOK,TS val 510076522 ecr 0,nop,wscale 7], length 0
11:21:49.310069 IP draculet-ThinkPad-E470c.39558 > 8.12.18.89.vultr.com.9981: Flags [S], seq 1668820038, win 29200, options [mss 1460,sackOK,TS val 510076523 ecr 0,nop,wscale 7], length 0
11:21:49.310140 IP draculet-ThinkPad-E470c.39560 > 8.12.18.89.vultr.com.9981: Flags [S], seq 570823288, win 29200, options [mss 1460,sackOK,TS val 510076523 ecr 0,nop,wscale 7], length 0
11:21:49.310189 IP draculet-ThinkPad-E470c.39562 > 8.12.18.89.vultr.com.9981: Flags [S], seq 238847408, win 29200, options [mss 1460,sackOK,TS val 510076523 ecr 0,nop,wscale 7], length 0
11:21:49.310238 IP draculet-ThinkPad-E470c.39564 > 8.12.18.89.vultr.com.9981: Flags [S], seq 3694481097, win 29200, options [mss 1460,sackOK,TS val 510076523 ecr 0,nop,wscale 7], length 0
11:21:49.310336 IP draculet-ThinkPad-E470c.39566 > 8.12.18.89.vultr.com.9981: Flags [S], seq 4040494304, win 29200, options [mss 1460,sackOK,TS val 510076523 ecr 0,nop,wscale 7], length 0
11:21:49.310382 IP draculet-ThinkPad-E470c.39568 > 8.12.18.89.vultr.com.9981: Flags [S], seq 3270502594, win 29200, options [mss 1460,sackOK,TS val 510076523 ecr 0,nop,wscale 7], length 0
11:21:49.310424 IP draculet-ThinkPad-E470c.39570 > 8.12.18.89.vultr.com.9981: Flags [S], seq 758385239, win 29200, options [mss 1460,sackOK,TS val 510076523 ecr 0,nop,wscale 7], length 0
11:21:49.310464 IP draculet-ThinkPad-E470c.39572 > 8.12.18.89.vultr.com.9981: Flags [S], seq 1706183003, win 29200, options [mss 1460,sackOK,TS val 510076523 ecr 0,nop,wscale 7], length 0
11:21:49.310561 IP draculet-ThinkPad-E470c.39574 > 8.12.18.89.vultr.com.9981: Flags [S], seq 4062258500, win 29200, options [mss 1460,sackOK,TS val 510076523 ecr 0,nop,wscale 7], length 0
11:21:49.310605 IP draculet-ThinkPad-E470c.39576 > 8.12.18.89.vultr.com.9981: Flags [S], seq 4201500286, win 29200, options [mss 1460,sackOK,TS val 510076523 ecr 0,nop,wscale 7], length 0
11:21:49.310644 IP draculet-ThinkPad-E470c.39578 > 8.12.18.89.vultr.com.9981: Flags [S], seq 4260067038, win 29200, options [mss 1460,sackOK,TS val 510076523 ecr 0,nop,wscale 7], length 0
11:21:49.310688 IP draculet-ThinkPad-E470c.39580 > 8.12.18.89.vultr.com.9981: Flags [S], seq 1887216351, win 29200, options [mss 1460,sackOK,TS val 510076523 ecr 0,nop,wscale 7], length 0
11:21:49.310788 IP draculet-ThinkPad-E470c.39582 > 8.12.18.89.vultr.com.9981: Flags [S], seq 3303913691, win 29200, options [mss 1460,sackOK,TS val 510076523 ecr 0,nop,wscale 7], length 0
11:21:49.310830 IP draculet-ThinkPad-E470c.39584 > 8.12.18.89.vultr.com.9981: Flags [S], seq 4281612726, win 29200, options [mss 1460,sackOK,TS val 510076523 ecr 0,nop,wscale 7], length 0
11:21:49.310871 IP draculet-ThinkPad-E470c.39586 > 8.12.18.89.vultr.com.9981: Flags [S], seq 1918294372, win 29200, options [mss 1460,sackOK,TS val 510076523 ecr 0,nop,wscale 7], length 0
11:21:49.310911 IP draculet-ThinkPad-E470c.39588 > 8.12.18.89.vultr.com.9981: Flags [S], seq 2403959774, win 29200, options [mss 1460,sackOK,TS val 510076523 ecr 0,nop,wscale 7], length 0
11:21:49.310950 IP draculet-ThinkPad-E470c.39590 > 8.12.18.89.vultr.com.9981: Flags [S], seq 3340303120, win 29200, options [mss 1460,sackOK,TS val 510076523 ecr 0,nop,wscale 7], length 0
11:21:49.311000 IP draculet-ThinkPad-E470c.39592 > 8.12.18.89.vultr.com.9981: Flags [S], seq 251825158, win 29200, options [mss 1460,sackOK,TS val 510076523 ecr 0,nop,wscale 7], length 0
11:21:49.311050 IP draculet-ThinkPad-E470c.39594 > 8.12.18.89.vultr.com.9981: Flags [S], seq 1769074428, win 29200, options [mss 1460,sackOK,TS val 510076523 ecr 0,nop,wscale 7], length 0
11:21:49.311097 IP draculet-ThinkPad-E470c.39596 > 8.12.18.89.vultr.com.9981: Flags [S], seq 1333089378, win 29200, options [mss 1460,sackOK,TS val 510076523 ecr 0,nop,wscale 7], length 0
11:21:49.311115 IP draculet-ThinkPad-E470c.39598 > 8.12.18.89.vultr.com.9981: Flags [S], seq 3739511089, win 29200, options [mss 1460,sackOK,TS val 510076523 ecr 0,nop,wscale 7], length 0
11:21:49.311138 IP draculet-ThinkPad-E470c.39600 > 8.12.18.89.vultr.com.9981: Flags [S], seq 3512636953, win 29200, options [mss 1460,sackOK,TS val 510076523 ecr 0,nop,wscale 7], length 0
11:21:49.311179 IP draculet-ThinkPad-E470c.39602 > 8.12.18.89.vultr.com.9981: Flags [S], seq 2115796036, win 29200, options [mss 1460,sackOK,TS val 510076523 ecr 0,nop,wscale 7], length 0
11:21:49.311193 IP draculet-ThinkPad-E470c.39604 > 8.12.18.89.vultr.com.9981: Flags [S], seq 290427108, win 29200, options [mss 1460,sackOK,TS val 510076523 ecr 0,nop,wscale 7], length 0
11:21:49.311276 IP draculet-ThinkPad-E470c.39606 > 8.12.18.89.vultr.com.9981: Flags [S], seq 1154113053, win 29200, options [mss 1460,sackOK,TS val 510076523 ecr 0,nop,wscale 7], length 0
11:21:49.311298 IP draculet-ThinkPad-E470c.39608 > 8.12.18.89.vultr.com.9981: Flags [S], seq 1881805963, win 29200, options [mss 1460,sackOK,TS val 510076523 ecr 0,nop,wscale 7], length 0
11:21:49.311344 IP draculet-ThinkPad-E470c.39610 > 8.12.18.89.vultr.com.9981: Flags [S], seq 2997487440, win 29200, options [mss 1460,sackOK,TS val 510076523 ecr 0,nop,wscale 7], length 0
11:21:49.311368 IP draculet-ThinkPad-E470c.39612 > 8.12.18.89.vultr.com.9981: Flags [S], seq 922824436, win 29200, options [mss 1460,sackOK,TS val 510076523 ecr 0,nop,wscale 7], length 0
11:21:49.311436 IP draculet-ThinkPad-E470c.39614 > 8.12.18.89.vultr.com.9981: Flags [S], seq 3693135982, win 29200, options [mss 1460,sackOK,TS val 510076523 ecr 0,nop,wscale 7], length 0
11:21:49.311454 IP draculet-ThinkPad-E470c.39616 > 8.12.18.89.vultr.com.9981: Flags [S], seq 3309921173, win 29200, options [mss 1460,sackOK,TS val 510076523 ecr 0,nop,wscale 7], length 0
11:21:49.311520 IP draculet-ThinkPad-E470c.39618 > 8.12.18.89.vultr.com.9981: Flags [S], seq 3034161571, win 29200, options [mss 1460,sackOK,TS val 510076523 ecr 0,nop,wscale 7], length 0
11:21:49.311543 IP draculet-ThinkPad-E470c.39620 > 8.12.18.89.vultr.com.9981: Flags [S], seq 2662403162, win 29200, options [mss 1460,sackOK,TS val 510076523 ecr 0,nop,wscale 7], length 0
11:21:49.311588 IP draculet-ThinkPad-E470c.39622 > 8.12.18.89.vultr.com.9981: Flags [S], seq 2051170523, win 29200, options [mss 1460,sackOK,TS val 510076523 ecr 0,nop,wscale 7], length 0
11:21:49.311604 IP draculet-ThinkPad-E470c.39624 > 8.12.18.89.vultr.com.9981: Flags [S], seq 4188876238, win 29200, options [mss 1460,sackOK,TS val 510076523 ecr 0,nop,wscale 7], length 0
11:21:49.311783 IP draculet-ThinkPad-E470c.39626 > 8.12.18.89.vultr.com.9981: Flags [S], seq 4184700842, win 29200, options [mss 1460,sackOK,TS val 510076523 ecr 0,nop,wscale 7], length 0
11:21:49.311893 IP draculet-ThinkPad-E470c.39628 > 8.12.18.89.vultr.com.9981: Flags [S], seq 2008437057, win 29200, options [mss 1460,sackOK,TS val 510076523 ecr 0,nop,wscale 7], length 0
11:21:49.311937 IP draculet-ThinkPad-E470c.39630 > 8.12.18.89.vultr.com.9981: Flags [S], seq 1316283346, win 29200, options [mss 1460,sackOK,TS val 510076523 ecr 0,nop,wscale 7], length 0
11:21:49.312001 IP draculet-ThinkPad-E470c.39632 > 8.12.18.89.vultr.com.9981: Flags [S], seq 686520689, win 29200, options [mss 1460,sackOK,TS val 510076523 ecr 0,nop,wscale 7], length 0
11:21:49.312014 IP draculet-ThinkPad-E470c.39634 > 8.12.18.89.vultr.com.9981: Flags [S], seq 3552374846, win 29200, options [mss 1460,sackOK,TS val 510076523 ecr 0,nop,wscale 7], length 0
11:21:49.312040 IP draculet-ThinkPad-E470c.39636 > 8.12.18.89.vultr.com.9981: Flags [S], seq 1934318363, win 29200, options [mss 1460,sackOK,TS val 510076523 ecr 0,nop,wscale 7], length 0
11:21:49.312055 IP draculet-ThinkPad-E470c.39638 > 8.12.18.89.vultr.com.9981: Flags [S], seq 916159009, win 29200, options [mss 1460,sackOK,TS val 510076523 ecr 0,nop,wscale 7], length 0
11:21:49.312081 IP draculet-ThinkPad-E470c.39640 > 8.12.18.89.vultr.com.9981: Flags [S], seq 821184104, win 29200, options [mss 1460,sackOK,TS val 510076523 ecr 0,nop,wscale 7], length 0
11:21:49.312095 IP draculet-ThinkPad-E470c.39642 > 8.12.18.89.vultr.com.9981: Flags [S], seq 3919249470, win 29200, options [mss 1460,sackOK,TS val 510076523 ecr 0,nop,wscale 7], length 0
11:21:49.312121 IP draculet-ThinkPad-E470c.39644 > 8.12.18.89.vultr.com.9981: Flags [S], seq 2658492178, win 29200, options [mss 1460,sackOK,TS val 510076523 ecr 0,nop,wscale 7], length 0
11:21:49.312134 IP draculet-ThinkPad-E470c.39646 > 8.12.18.89.vultr.com.9981: Flags [S], seq 3458627006, win 29200, options [mss 1460,sackOK,TS val 510076523 ecr 0,nop,wscale 7], length 0
11:21:49.312148 IP draculet-ThinkPad-E470c.39648 > 8.12.18.89.vultr.com.9981: Flags [S], seq 3396445435, win 29200, options [mss 1460,sackOK,TS val 510076523 ecr 0,nop,wscale 7], length 0
11:21:49.312175 IP draculet-ThinkPad-E470c.39650 > 8.12.18.89.vultr.com.9981: Flags [S], seq 2480307393, win 29200, options [mss 1460,sackOK,TS val 510076523 ecr 0,nop,wscale 7], length 0
11:21:49.312189 IP draculet-ThinkPad-E470c.39652 > 8.12.18.89.vultr.com.9981: Flags [S], seq 1220842723, win 29200, options [mss 1460,sackOK,TS val 510076523 ecr 0,nop,wscale 7], length 0
11:21:49.312201 IP draculet-ThinkPad-E470c.39654 > 8.12.18.89.vultr.com.9981: Flags [S], seq 2253790822, win 29200, options [mss 1460,sackOK,TS val 510076523 ecr 0,nop,wscale 7], length 0
11:21:49.312228 IP draculet-ThinkPad-E470c.39656 > 8.12.18.89.vultr.com.9981: Flags [S], seq 1803094116, win 29200, options [mss 1460,sackOK,TS val 510076523 ecr 0,nop,wscale 7], length 0
11:21:49.312241 IP draculet-ThinkPad-E470c.39658 > 8.12.18.89.vultr.com.9981: Flags [S], seq 945441239, win 29200, options [mss 1460,sackOK,TS val 510076523 ecr 0,nop,wscale 7], length 0
11:21:49.312269 IP draculet-ThinkPad-E470c.39660 > 8.12.18.89.vultr.com.9981: Flags [S], seq 2491722708, win 29200, options [mss 1460,sackOK,TS val 510076523 ecr 0,nop,wscale 7], length 0
11:21:49.312283 IP draculet-ThinkPad-E470c.39662 > 8.12.18.89.vultr.com.9981: Flags [S], seq 1695092323, win 29200, options [mss 1460,sackOK,TS val 510076523 ecr 0,nop,wscale 7], length 0
11:21:49.312295 IP draculet-ThinkPad-E470c.39664 > 8.12.18.89.vultr.com.9981: Flags [S], seq 4089782463, win 29200, options [mss 1460,sackOK,TS val 510076523 ecr 0,nop,wscale 7], length 0
11:21:49.312308 IP draculet-ThinkPad-E470c.39666 > 8.12.18.89.vultr.com.9981: Flags [S], seq 3114140308, win 29200, options [mss 1460,sackOK,TS val 510076523 ecr 0,nop,wscale 7], length 0
11:21:49.312336 IP draculet-ThinkPad-E470c.39668 > 8.12.18.89.vultr.com.9981: Flags [S], seq 2122283519, win 29200, options [mss 1460,sackOK,TS val 510076523 ecr 0,nop,wscale 7], length 0
11:21:49.312349 IP draculet-ThinkPad-E470c.39670 > 8.12.18.89.vultr.com.9981: Flags [S], seq 2432254042, win 29200, options [mss 1460,sackOK,TS val 510076523 ecr 0,nop,wscale 7], length 0
11:21:49.312360 IP draculet-ThinkPad-E470c.39672 > 8.12.18.89.vultr.com.9981: Flags [S], seq 3835072766, win 29200, options [mss 1460,sackOK,TS val 510076523 ecr 0,nop,wscale 7], length 0
11:21:49.312373 IP draculet-ThinkPad-E470c.39674 > 8.12.18.89.vultr.com.9981: Flags [S], seq 635836706, win 29200, options [mss 1460,sackOK,TS val 510076523 ecr 0,nop,wscale 7], length 0
11:21:49.312395 IP draculet-ThinkPad-E470c.39676 > 8.12.18.89.vultr.com.9981: Flags [S], seq 3537000678, win 29200, options [mss 1460,sackOK,TS val 510076523 ecr 0,nop,wscale 7], length 0
11:21:49.312401 IP draculet-ThinkPad-E470c.39678 > 8.12.18.89.vultr.com.9981: Flags [S], seq 3019839251, win 29200, options [mss 1460,sackOK,TS val 510076523 ecr 0,nop,wscale 7], length 0
11:21:49.312411 IP draculet-ThinkPad-E470c.39680 > 8.12.18.89.vultr.com.9981: Flags [S], seq 3841223862, win 29200, options [mss 1460,sackOK,TS val 510076523 ecr 0,nop,wscale 7], length 0
11:21:49.312416 IP draculet-ThinkPad-E470c.39682 > 8.12.18.89.vultr.com.9981: Flags [S], seq 4145564724, win 29200, options [mss 1460,sackOK,TS val 510076523 ecr 0,nop,wscale 7], length 0
11:21:49.312424 IP draculet-ThinkPad-E470c.39684 > 8.12.18.89.vultr.com.9981: Flags [S], seq 748712204, win 29200, options [mss 1460,sackOK,TS val 510076523 ecr 0,nop,wscale 7], length 0
11:21:49.312429 IP draculet-ThinkPad-E470c.39686 > 8.12.18.89.vultr.com.9981: Flags [S], seq 993904686, win 29200, options [mss 1460,sackOK,TS val 510076523 ecr 0,nop,wscale 7], length 0
11:21:49.312437 IP draculet-ThinkPad-E470c.39688 > 8.12.18.89.vultr.com.9981: Flags [S], seq 3639251981, win 29200, options [mss 1460,sackOK,TS val 510076523 ecr 0,nop,wscale 7], length 0
11:21:49.312461 IP draculet-ThinkPad-E470c.39690 > 8.12.18.89.vultr.com.9981: Flags [S], seq 4076817172, win 29200, options [mss 1460,sackOK,TS val 510076523 ecr 0,nop,wscale 7], length 0
11:21:49.312466 IP draculet-ThinkPad-E470c.39692 > 8.12.18.89.vultr.com.9981: Flags [S], seq 3251912026, win 29200, options [mss 1460,sackOK,TS val 510076523 ecr 0,nop,wscale 7], length 0
11:21:49.312471 IP draculet-ThinkPad-E470c.39694 > 8.12.18.89.vultr.com.9981: Flags [S], seq 1874753, win 29200, options [mss 1460,sackOK,TS val 510076523 ecr 0,nop,wscale 7], length 0
11:21:49.312491 IP draculet-ThinkPad-E470c.39696 > 8.12.18.89.vultr.com.9981: Flags [S], seq 1843870768, win 29200, options [mss 1460,sackOK,TS val 510076523 ecr 0,nop,wscale 7], length 0
11:21:49.312498 IP draculet-ThinkPad-E470c.39698 > 8.12.18.89.vultr.com.9981: Flags [S], seq 3864355898, win 29200, options [mss 1460,sackOK,TS val 510076523 ecr 0,nop,wscale 7], length 0
11:21:49.312516 IP draculet-ThinkPad-E470c.39700 > 8.12.18.89.vultr.com.9981: Flags [S], seq 335334989, win 29200, options [mss 1460,sackOK,TS val 510076523 ecr 0,nop,wscale 7], length 0
11:21:49.312522 IP draculet-ThinkPad-E470c.39702 > 8.12.18.89.vultr.com.9981: Flags [S], seq 4121822472, win 29200, options [mss 1460,sackOK,TS val 510076523 ecr 0,nop,wscale 7], length 0
11:21:49.312543 IP draculet-ThinkPad-E470c.39704 > 8.12.18.89.vultr.com.9981: Flags [S], seq 3761269363, win 29200, options [mss 1460,sackOK,TS val 510076523 ecr 0,nop,wscale 7], length 0
11:21:49.312570 IP draculet-ThinkPad-E470c.39706 > 8.12.18.89.vultr.com.9981: Flags [S], seq 178904956, win 29200, options [mss 1460,sackOK,TS val 510076523 ecr 0,nop,wscale 7], length 0
11:21:49.312599 IP draculet-ThinkPad-E470c.39708 > 8.12.18.89.vultr.com.9981: Flags [S], seq 2697638741, win 29200, options [mss 1460,sackOK,TS val 510076523 ecr 0,nop,wscale 7], length 0
11:21:49.312631 IP draculet-ThinkPad-E470c.39710 > 8.12.18.89.vultr.com.9981: Flags [S], seq 3542259689, win 29200, options [mss 1460,sackOK,TS val 510076523 ecr 0,nop,wscale 7], length 0
11:21:49.312660 IP draculet-ThinkPad-E470c.39712 > 8.12.18.89.vultr.com.9981: Flags [S], seq 3148545824, win 29200, options [mss 1460,sackOK,TS val 510076523 ecr 0,nop,wscale 7], length 0
11:21:49.312689 IP draculet-ThinkPad-E470c.39714 > 8.12.18.89.vultr.com.9981: Flags [S], seq 1779813187, win 29200, options [mss 1460,sackOK,TS val 510076523 ecr 0,nop,wscale 7], length 0
11:21:49.312719 IP draculet-ThinkPad-E470c.39716 > 8.12.18.89.vultr.com.9981: Flags [S], seq 3943714575, win 29200, options [mss 1460,sackOK,TS val 510076523 ecr 0,nop,wscale 7], length 0
11:21:49.312750 IP draculet-ThinkPad-E470c.39718 > 8.12.18.89.vultr.com.9981: Flags [S], seq 1942342435, win 29200, options [mss 1460,sackOK,TS val 510076523 ecr 0,nop,wscale 7], length 0
11:21:49.312755 IP draculet-ThinkPad-E470c.39720 > 8.12.18.89.vultr.com.9981: Flags [S], seq 1759420945, win 29200, options [mss 1460,sackOK,TS val 510076523 ecr 0,nop,wscale 7], length 0
11:21:49.312763 IP draculet-ThinkPad-E470c.39722 > 8.12.18.89.vultr.com.9981: Flags [S], seq 2252584272, win 29200, options [mss 1460,sackOK,TS val 510076523 ecr 0,nop,wscale 7], length 0
11:21:49.312779 IP draculet-ThinkPad-E470c.39724 > 8.12.18.89.vultr.com.9981: Flags [S], seq 2136580948, win 29200, options [mss 1460,sackOK,TS val 510076523 ecr 0,nop,wscale 7], length 0
11:21:49.312804 IP draculet-ThinkPad-E470c.39726 > 8.12.18.89.vultr.com.9981: Flags [S], seq 2738478033, win 29200, options [mss 1460,sackOK,TS val 510076523 ecr 0,nop,wscale 7], length 0
11:21:49.312831 IP draculet-ThinkPad-E470c.39728 > 8.12.18.89.vultr.com.9981: Flags [S], seq 3710054599, win 29200, options [mss 1460,sackOK,TS val 510076523 ecr 0,nop,wscale 7], length 0
11:21:49.312856 IP draculet-ThinkPad-E470c.39730 > 8.12.18.89.vultr.com.9981: Flags [S], seq 4172744797, win 29200, options [mss 1460,sackOK,TS val 510076523 ecr 0,nop,wscale 7], length 0
11:21:49.312883 IP draculet-ThinkPad-E470c.39732 > 8.12.18.89.vultr.com.9981: Flags [S], seq 1582547619, win 29200, options [mss 1460,sackOK,TS val 510076523 ecr 0,nop,wscale 7], length 0
11:21:49.312909 IP draculet-ThinkPad-E470c.39734 > 8.12.18.89.vultr.com.9981: Flags [S], seq 2482920849, win 29200, options [mss 1460,sackOK,TS val 510076523 ecr 0,nop,wscale 7], length 0
11:21:49.312937 IP draculet-ThinkPad-E470c.39736 > 8.12.18.89.vultr.com.9981: Flags [S], seq 2597744996, win 29200, options [mss 1460,sackOK,TS val 510076523 ecr 0,nop,wscale 7], length 0
11:21:49.312962 IP draculet-ThinkPad-E470c.39738 > 8.12.18.89.vultr.com.9981: Flags [S], seq 825260589, win 29200, options [mss 1460,sackOK,TS val 510076523 ecr 0,nop,wscale 7], length 0
11:21:49.312987 IP draculet-ThinkPad-E470c.39740 > 8.12.18.89.vultr.com.9981: Flags [S], seq 2165238774, win 29200, options [mss 1460,sackOK,TS val 510076523 ecr 0,nop,wscale 7], length 0
11:21:49.312993 IP draculet-ThinkPad-E470c.39742 > 8.12.18.89.vultr.com.9981: Flags [S], seq 857595730, win 29200, options [mss 1460,sackOK,TS val 510076523 ecr 0,nop,wscale 7], length 0
11:21:49.313059 IP draculet-ThinkPad-E470c.39744 > 8.12.18.89.vultr.com.9981: Flags [S], seq 4204663315, win 29200, options [mss 1460,sackOK,TS val 510076523 ecr 0,nop,wscale 7], length 0
11:21:49.313073 IP draculet-ThinkPad-E470c.39746 > 8.12.18.89.vultr.com.9981: Flags [S], seq 2068734844, win 29200, options [mss 1460,sackOK,TS val 510076523 ecr 0,nop,wscale 7], length 0
11:21:49.313084 IP draculet-ThinkPad-E470c.39748 > 8.12.18.89.vultr.com.9981: Flags [S], seq 1894601381, win 29200, options [mss 1460,sackOK,TS val 510076523 ecr 0,nop,wscale 7], length 0
11:21:49.313102 IP draculet-ThinkPad-E470c.39750 > 8.12.18.89.vultr.com.9981: Flags [S], seq 4265794287, win 29200, options [mss 1460,sackOK,TS val 510076523 ecr 0,nop,wscale 7], length 0
11:21:49.313114 IP draculet-ThinkPad-E470c.39752 > 8.12.18.89.vultr.com.9981: Flags [S], seq 3499807455, win 29200, options [mss 1460,sackOK,TS val 510076523 ecr 0,nop,wscale 7], length 0
11:21:49.313129 IP draculet-ThinkPad-E470c.39754 > 8.12.18.89.vultr.com.9981: Flags [S], seq 1770114355, win 29200, options [mss 1460,sackOK,TS val 510076523 ecr 0,nop,wscale 7], length 0
11:21:49.313155 IP draculet-ThinkPad-E470c.39756 > 8.12.18.89.vultr.com.9981: Flags [S], seq 331099617, win 29200, options [mss 1460,sackOK,TS val 510076523 ecr 0,nop,wscale 7], length 0
11:21:49.313181 IP draculet-ThinkPad-E470c.39758 > 8.12.18.89.vultr.com.9981: Flags [S], seq 3719171725, win 29200, options [mss 1460,sackOK,TS val 510076523 ecr 0,nop,wscale 7], length 0
11:21:49.313205 IP draculet-ThinkPad-E470c.39760 > 8.12.18.89.vultr.com.9981: Flags [S], seq 731974110, win 29200, options [mss 1460,sackOK,TS val 510076523 ecr 0,nop,wscale 7], length 0
11:21:49.313228 IP draculet-ThinkPad-E470c.39762 > 8.12.18.89.vultr.com.9981: Flags [S], seq 2309768177, win 29200, options [mss 1460,sackOK,TS val 510076523 ecr 0,nop,wscale 7], length 0
11:21:49.313252 IP draculet-ThinkPad-E470c.39764 > 8.12.18.89.vultr.com.9981: Flags [S], seq 4117973671, win 29200, options [mss 1460,sackOK,TS val 510076523 ecr 0,nop,wscale 7], length 0
11:21:49.313275 IP draculet-ThinkPad-E470c.39766 > 8.12.18.89.vultr.com.9981: Flags [S], seq 3486281647, win 29200, options [mss 1460,sackOK,TS val 510076523 ecr 0,nop,wscale 7], length 0
11:21:49.313299 IP draculet-ThinkPad-E470c.39768 > 8.12.18.89.vultr.com.9981: Flags [S], seq 2723897707, win 29200, options [mss 1460,sackOK,TS val 510076523 ecr 0,nop,wscale 7], length 0
11:21:49.313324 IP draculet-ThinkPad-E470c.39770 > 8.12.18.89.vultr.com.9981: Flags [S], seq 2147487570, win 29200, options [mss 1460,sackOK,TS val 510076523 ecr 0,nop,wscale 7], length 0
11:21:49.313347 IP draculet-ThinkPad-E470c.39772 > 8.12.18.89.vultr.com.9981: Flags [S], seq 242074737, win 29200, options [mss 1460,sackOK,TS val 510076523 ecr 0,nop,wscale 7], length 0
11:21:49.313371 IP draculet-ThinkPad-E470c.39774 > 8.12.18.89.vultr.com.9981: Flags [S], seq 1252372166, win 29200, options [mss 1460,sackOK,TS val 510076523 ecr 0,nop,wscale 7], length 0
11:21:49.313396 IP draculet-ThinkPad-E470c.39776 > 8.12.18.89.vultr.com.9981: Flags [S], seq 2694292454, win 29200, options [mss 1460,sackOK,TS val 510076523 ecr 0,nop,wscale 7], length 0
11:21:49.313420 IP draculet-ThinkPad-E470c.39778 > 8.12.18.89.vultr.com.9981: Flags [S], seq 4290303086, win 29200, options [mss 1460,sackOK,TS val 510076523 ecr 0,nop,wscale 7], length 0
11:21:49.313444 IP draculet-ThinkPad-E470c.39780 > 8.12.18.89.vultr.com.9981: Flags [S], seq 1481948846, win 29200, options [mss 1460,sackOK,TS val 510076523 ecr 0,nop,wscale 7], length 0
11:21:49.313468 IP draculet-ThinkPad-E470c.39782 > 8.12.18.89.vultr.com.9981: Flags [S], seq 322585829, win 29200, options [mss 1460,sackOK,TS val 510076523 ecr 0,nop,wscale 7], length 0
11:21:49.313494 IP draculet-ThinkPad-E470c.39784 > 8.12.18.89.vultr.com.9981: Flags [S], seq 896335288, win 29200, options [mss 1460,sackOK,TS val 510076523 ecr 0,nop,wscale 7], length 0
11:21:49.313498 IP draculet-ThinkPad-E470c.39786 > 8.12.18.89.vultr.com.9981: Flags [S], seq 818184290, win 29200, options [mss 1460,sackOK,TS val 510076523 ecr 0,nop,wscale 7], length 0
11:21:49.313508 IP draculet-ThinkPad-E470c.39788 > 8.12.18.89.vultr.com.9981: Flags [S], seq 1574226869, win 29200, options [mss 1460,sackOK,TS val 510076523 ecr 0,nop,wscale 7], length 0
11:21:49.313520 IP draculet-ThinkPad-E470c.39790 > 8.12.18.89.vultr.com.9981: Flags [S], seq 1878516802, win 29200, options [mss 1460,sackOK,TS val 510076523 ecr 0,nop,wscale 7], length 0
11:21:49.313529 IP draculet-ThinkPad-E470c.39792 > 8.12.18.89.vultr.com.9981: Flags [S], seq 3621663895, win 29200, options [mss 1460,sackOK,TS val 510076523 ecr 0,nop,wscale 7], length 0
11:21:49.313546 IP draculet-ThinkPad-E470c.39794 > 8.12.18.89.vultr.com.9981: Flags [S], seq 2598034901, win 29200, options [mss 1460,sackOK,TS val 510076523 ecr 0,nop,wscale 7], length 0
11:21:49.313553 IP draculet-ThinkPad-E470c.39796 > 8.12.18.89.vultr.com.9981: Flags [S], seq 1506236707, win 29200, options [mss 1460,sackOK,TS val 510076523 ecr 0,nop,wscale 7], length 0
11:21:49.313572 IP draculet-ThinkPad-E470c.39798 > 8.12.18.89.vultr.com.9981: Flags [S], seq 2577565862, win 29200, options [mss 1460,sackOK,TS val 510076523 ecr 0,nop,wscale 7], length 0
11:21:49.313578 IP draculet-ThinkPad-E470c.39800 > 8.12.18.89.vultr.com.9981: Flags [S], seq 3185945473, win 29200, options [mss 1460,sackOK,TS val 510076523 ecr 0,nop,wscale 7], length 0
11:21:49.313596 IP draculet-ThinkPad-E470c.39802 > 8.12.18.89.vultr.com.9981: Flags [S], seq 2465168496, win 29200, options [mss 1460,sackOK,TS val 510076523 ecr 0,nop,wscale 7], length 0
11:21:49.313622 IP draculet-ThinkPad-E470c.39804 > 8.12.18.89.vultr.com.9981: Flags [S], seq 2153252137, win 29200, options [mss 1460,sackOK,TS val 510076523 ecr 0,nop,wscale 7], length 0
11:21:49.313652 IP draculet-ThinkPad-E470c.39806 > 8.12.18.89.vultr.com.9981: Flags [S], seq 3674618308, win 29200, options [mss 1460,sackOK,TS val 510076523 ecr 0,nop,wscale 7], length 0
11:21:49.313674 IP draculet-ThinkPad-E470c.39808 > 8.12.18.89.vultr.com.9981: Flags [S], seq 1791068928, win 29200, options [mss 1460,sackOK,TS val 510076523 ecr 0,nop,wscale 7], length 0
11:21:49.313725 IP draculet-ThinkPad-E470c.39810 > 8.12.18.89.vultr.com.9981: Flags [S], seq 2129785359, win 29200, options [mss 1460,sackOK,TS val 510076523 ecr 0,nop,wscale 7], length 0
11:21:49.313754 IP draculet-ThinkPad-E470c.39812 > 8.12.18.89.vultr.com.9981: Flags [S], seq 3068237291, win 29200, options [mss 1460,sackOK,TS val 510076523 ecr 0,nop,wscale 7], length 0
11:21:49.313779 IP draculet-ThinkPad-E470c.39814 > 8.12.18.89.vultr.com.9981: Flags [S], seq 3170780596, win 29200, options [mss 1460,sackOK,TS val 510076523 ecr 0,nop,wscale 7], length 0
11:21:49.313853 IP draculet-ThinkPad-E470c.39818 > 8.12.18.89.vultr.com.9981: Flags [S], seq 2729181390, win 29200, options [mss 1460,sackOK,TS val 510076523 ecr 0,nop,wscale 7], length 0
11:21:49.313861 IP draculet-ThinkPad-E470c.39816 > 8.12.18.89.vultr.com.9981: Flags [S], seq 2713921387, win 29200, options [mss 1460,sackOK,TS val 510076523 ecr 0,nop,wscale 7], length 0
11:21:49.313917 IP draculet-ThinkPad-E470c.39820 > 8.12.18.89.vultr.com.9981: Flags [S], seq 617984147, win 29200, options [mss 1460,sackOK,TS val 510076523 ecr 0,nop,wscale 7], length 0
11:21:49.313935 IP draculet-ThinkPad-E470c.39822 > 8.12.18.89.vultr.com.9981: Flags [S], seq 962784288, win 29200, options [mss 1460,sackOK,TS val 510076523 ecr 0,nop,wscale 7], length 0
