18:38:41.918634 IP localhost.40987 > draculet-ThinkPad-E470c.domain: 33085+ A? clients1.google.com. (37)
18:38:41.918692 IP draculet-ThinkPad-E470c.domain > localhost.40987: 33085 Refused 0/0/0 (37)
18:38:41.918727 IP localhost.34472 > draculet-ThinkPad-E470c.domain: 33085+ A? clients1.google.com. (37)
18:38:41.918743 IP draculet-ThinkPad-E470c.domain > localhost.34472: 33085 Refused 0/0/0 (37)
18:38:41.918764 IP localhost.60456 > draculet-ThinkPad-E470c.domain: 30417+ A? clients1.google.com. (37)
18:38:41.918777 IP draculet-ThinkPad-E470c.domain > localhost.60456: 30417 Refused 0/0/0 (37)
18:38:41.918797 IP localhost.45783 > draculet-ThinkPad-E470c.domain: 30417+ A? clients1.google.com. (37)
18:38:41.918820 IP draculet-ThinkPad-E470c.domain > localhost.45783: 30417 Refused 0/0/0 (37)
18:38:42.274209 IP localhost.43382 > draculet-ThinkPad-E470c.domain: 30206+ A? clients1.google.com. (37)
18:38:42.274259 IP draculet-ThinkPad-E470c.domain > localhost.43382: 30206 Refused 0/0/0 (37)
18:38:42.274303 IP localhost.33438 > draculet-ThinkPad-E470c.domain: 30206+ A? clients1.google.com. (37)
18:38:42.274330 IP draculet-ThinkPad-E470c.domain > localhost.33438: 30206 Refused 0/0/0 (37)
18:38:42.274356 IP localhost.40837 > draculet-ThinkPad-E470c.domain: 36955+ A? clients1.google.com. (37)
18:38:42.274373 IP draculet-ThinkPad-E470c.domain > localhost.40837: 36955 Refused 0/0/0 (37)
18:38:42.274393 IP localhost.42787 > draculet-ThinkPad-E470c.domain: 36955+ A? clients1.google.com. (37)
18:38:42.274408 IP draculet-ThinkPad-E470c.domain > localhost.42787: 36955 Refused 0/0/0 (37)
18:38:42.286730 IP localhost.50592 > localhost.9981: Flags [S], seq 3841798231, win 43690, options [mss 65495,sackOK,TS val 1915561518 ecr 0,nop,wscale 7], length 0
18:38:42.286731 IP localhost.50594 > localhost.9981: Flags [S], seq 465784910, win 43690, options [mss 65495,sackOK,TS val 1915561518 ecr 0,nop,wscale 7], length 0
18:38:42.286742 IP localhost.9981 > localhost.50592: Flags [S.], seq 3819540582, ack 3841798232, win 43690, options [mss 65495,sackOK,TS val 1915561518 ecr 1915561518,nop,wscale 7], length 0
18:38:42.286743 IP localhost.9981 > localhost.50594: Flags [S.], seq 1104160444, ack 465784911, win 43690, options [mss 65495,sackOK,TS val 1915561518 ecr 1915561518,nop,wscale 7], length 0
18:38:42.286754 IP localhost.50592 > localhost.9981: Flags [.], ack 1, win 342, options [nop,nop,TS val 1915561518 ecr 1915561518], length 0
18:38:42.286755 IP localhost.50594 > localhost.9981: Flags [.], ack 1, win 342, options [nop,nop,TS val 1915561518 ecr 1915561518], length 0
18:38:42.286782 IP localhost.50598 > localhost.9981: Flags [S], seq 2982027013, win 43690, options [mss 65495,sackOK,TS val 1915561518 ecr 0,nop,wscale 7], length 0
18:38:42.286786 IP localhost.9981 > localhost.50598: Flags [S.], seq 4162460499, ack 2982027014, win 43690, options [mss 65495,sackOK,TS val 1915561518 ecr 1915561518,nop,wscale 7], length 0
18:38:42.286791 IP localhost.50598 > localhost.9981: Flags [.], ack 1, win 342, options [nop,nop,TS val 1915561518 ecr 1915561518], length 0
18:38:42.286846 IP localhost.50600 > localhost.9981: Flags [S], seq 514751090, win 43690, options [mss 65495,sackOK,TS val 1915561518 ecr 0,nop,wscale 7], length 0
18:38:42.286852 IP localhost.9981 > localhost.50600: Flags [S.], seq 2859526693, ack 514751091, win 43690, options [mss 65495,sackOK,TS val 1915561518 ecr 1915561518,nop,wscale 7], length 0
18:38:42.286856 IP localhost.50602 > localhost.9981: Flags [S], seq 2160722910, win 43690, options [mss 65495,sackOK,TS val 1915561518 ecr 0,nop,wscale 7], length 0
18:38:42.286858 IP localhost.50600 > localhost.9981: Flags [.], ack 1, win 342, options [nop,nop,TS val 1915561518 ecr 1915561518], length 0
18:38:42.286860 IP localhost.9981 > localhost.50602: Flags [S.], seq 3539153292, ack 2160722911, win 43690, options [mss 65495,sackOK,TS val 1915561518 ecr 1915561518,nop,wscale 7], length 0
18:38:42.286865 IP localhost.50602 > localhost.9981: Flags [.], ack 1, win 342, options [nop,nop,TS val 1915561518 ecr 1915561518], length 0
18:38:42.286876 IP localhost.50604 > localhost.9981: Flags [S], seq 3273032274, win 43690, options [mss 65495,sackOK,TS val 1915561518 ecr 0,nop,wscale 7], length 0
18:38:42.286877 IP localhost.50606 > localhost.9981: Flags [S], seq 3181071003, win 43690, options [mss 65495,sackOK,TS val 1915561518 ecr 0,nop,wscale 7], length 0
18:38:42.286880 IP localhost.9981 > localhost.50604: Flags [S.], seq 3055831065, ack 3273032275, win 43690, options [mss 65495,sackOK,TS val 1915561518 ecr 1915561518,nop,wscale 7], length 0
18:38:42.286881 IP localhost.9981 > localhost.50606: Flags [S.], seq 3981835311, ack 3181071004, win 43690, options [mss 65495,sackOK,TS val 1915561518 ecr 1915561518,nop,wscale 7], length 0
18:38:42.286884 IP localhost.50606 > localhost.9981: Flags [.], ack 1, win 342, options [nop,nop,TS val 1915561518 ecr 1915561518], length 0
18:38:42.286885 IP localhost.50604 > localhost.9981: Flags [.], ack 1, win 342, options [nop,nop,TS val 1915561518 ecr 1915561518], length 0
18:38:42.286895 IP localhost.50608 > localhost.9981: Flags [S], seq 2527099291, win 43690, options [mss 65495,sackOK,TS val 1915561518 ecr 0,nop,wscale 7], length 0
18:38:42.286901 IP localhost.50610 > localhost.9981: Flags [S], seq 1754417515, win 43690, options [mss 65495,sackOK,TS val 1915561518 ecr 0,nop,wscale 7], length 0
18:38:42.286907 IP localhost.50612 > localhost.9981: Flags [S], seq 3716483803, win 43690, options [mss 65495,sackOK,TS val 1915561518 ecr 0,nop,wscale 7], length 0
18:38:42.286908 IP localhost.50614 > localhost.9981: Flags [S], seq 3874435432, win 43690, options [mss 65495,sackOK,TS val 1915561518 ecr 0,nop,wscale 7], length 0
18:38:42.286916 IP localhost.50616 > localhost.9981: Flags [S], seq 2050045935, win 43690, options [mss 65495,sackOK,TS val 1915561518 ecr 0,nop,wscale 7], length 0
18:38:42.286919 IP localhost.50618 > localhost.9981: Flags [S], seq 1615277640, win 43690, options [mss 65495,sackOK,TS val 1915561518 ecr 0,nop,wscale 7], length 0
18:38:42.286931 IP localhost.50620 > localhost.9981: Flags [S], seq 130093976, win 43690, options [mss 65495,sackOK,TS val 1915561518 ecr 0,nop,wscale 7], length 0
18:38:42.286940 IP localhost.50622 > localhost.9981: Flags [S], seq 3208585581, win 43690, options [mss 65495,sackOK,TS val 1915561518 ecr 0,nop,wscale 7], length 0
18:38:42.286944 IP localhost.50624 > localhost.9981: Flags [S], seq 3689160601, win 43690, options [mss 65495,sackOK,TS val 1915561518 ecr 0,nop,wscale 7], length 0
18:38:42.286951 IP localhost.50626 > localhost.9981: Flags [S], seq 1688054, win 43690, options [mss 65495,sackOK,TS val 1915561518 ecr 0,nop,wscale 7], length 0
18:38:42.286972 IP localhost.50628 > localhost.9981: Flags [S], seq 3019799743, win 43690, options [mss 65495,sackOK,TS val 1915561518 ecr 0,nop,wscale 7], length 0
18:38:42.286993 IP localhost.50630 > localhost.9981: Flags [S], seq 1866497372, win 43690, options [mss 65495,sackOK,TS val 1915561518 ecr 0,nop,wscale 7], length 0
18:38:42.287135 IP localhost.50632 > localhost.9981: Flags [S], seq 1780106427, win 43690, options [mss 65495,sackOK,TS val 1915561518 ecr 0,nop,wscale 7], length 0
18:38:42.287175 IP localhost.50634 > localhost.9981: Flags [S], seq 418358429, win 43690, options [mss 65495,sackOK,TS val 1915561518 ecr 0,nop,wscale 7], length 0
18:38:42.287226 IP localhost.50636 > localhost.9981: Flags [S], seq 4193812533, win 43690, options [mss 65495,sackOK,TS val 1915561519 ecr 0,nop,wscale 7], length 0
18:38:42.287238 IP localhost.50638 > localhost.9981: Flags [S], seq 2628719091, win 43690, options [mss 65495,sackOK,TS val 1915561519 ecr 0,nop,wscale 7], length 0
18:38:42.287259 IP localhost.50640 > localhost.9981: Flags [S], seq 2393789709, win 43690, options [mss 65495,sackOK,TS val 1915561519 ecr 0,nop,wscale 7], length 0
18:38:42.287277 IP localhost.50642 > localhost.9981: Flags [S], seq 3338483857, win 43690, options [mss 65495,sackOK,TS val 1915561519 ecr 0,nop,wscale 7], length 0
18:38:42.287286 IP localhost.50644 > localhost.9981: Flags [S], seq 517575913, win 43690, options [mss 65495,sackOK,TS val 1915561519 ecr 0,nop,wscale 7], length 0
18:38:42.291212 IP localhost.50646 > localhost.9981: Flags [S], seq 894680662, win 43690, options [mss 65495,sackOK,TS val 1915561520 ecr 0,nop,wscale 7], length 0
18:38:43.315220 IP localhost.50630 > localhost.9981: Flags [S], seq 1866497372, win 43690, options [mss 65495,sackOK,TS val 1915561776 ecr 0,nop,wscale 7], length 0
18:38:43.315225 IP localhost.50628 > localhost.9981: Flags [S], seq 3019799743, win 43690, options [mss 65495,sackOK,TS val 1915561776 ecr 0,nop,wscale 7], length 0
18:38:43.315226 IP localhost.50626 > localhost.9981: Flags [S], seq 1688054, win 43690, options [mss 65495,sackOK,TS val 1915561776 ecr 0,nop,wscale 7], length 0
18:38:43.315227 IP localhost.50622 > localhost.9981: Flags [S], seq 3208585581, win 43690, options [mss 65495,sackOK,TS val 1915561776 ecr 0,nop,wscale 7], length 0
18:38:43.315228 IP localhost.50616 > localhost.9981: Flags [S], seq 2050045935, win 43690, options [mss 65495,sackOK,TS val 1915561776 ecr 0,nop,wscale 7], length 0
18:38:43.315229 IP localhost.50612 > localhost.9981: Flags [S], seq 3716483803, win 43690, options [mss 65495,sackOK,TS val 1915561776 ecr 0,nop,wscale 7], length 0
18:38:43.315230 IP localhost.50608 > localhost.9981: Flags [S], seq 2527099291, win 43690, options [mss 65495,sackOK,TS val 1915561776 ecr 0,nop,wscale 7], length 0
18:38:43.315234 IP localhost.50646 > localhost.9981: Flags [S], seq 894680662, win 43690, options [mss 65495,sackOK,TS val 1915561776 ecr 0,nop,wscale 7], length 0
18:38:43.315237 IP localhost.50644 > localhost.9981: Flags [S], seq 517575913, win 43690, options [mss 65495,sackOK,TS val 1915561776 ecr 0,nop,wscale 7], length 0
18:38:43.315238 IP localhost.50642 > localhost.9981: Flags [S], seq 3338483857, win 43690, options [mss 65495,sackOK,TS val 1915561776 ecr 0,nop,wscale 7], length 0
18:38:43.315239 IP localhost.50640 > localhost.9981: Flags [S], seq 2393789709, win 43690, options [mss 65495,sackOK,TS val 1915561776 ecr 0,nop,wscale 7], length 0
18:38:43.315239 IP localhost.50638 > localhost.9981: Flags [S], seq 2628719091, win 43690, options [mss 65495,sackOK,TS val 1915561776 ecr 0,nop,wscale 7], length 0
18:38:43.315240 IP localhost.50636 > localhost.9981: Flags [S], seq 4193812533, win 43690, options [mss 65495,sackOK,TS val 1915561776 ecr 0,nop,wscale 7], length 0
18:38:43.315241 IP localhost.50634 > localhost.9981: Flags [S], seq 418358429, win 43690, options [mss 65495,sackOK,TS val 1915561776 ecr 0,nop,wscale 7], length 0
18:38:43.315242 IP localhost.50632 > localhost.9981: Flags [S], seq 1780106427, win 43690, options [mss 65495,sackOK,TS val 1915561776 ecr 0,nop,wscale 7], length 0
18:38:43.315242 IP localhost.50624 > localhost.9981: Flags [S], seq 3689160601, win 43690, options [mss 65495,sackOK,TS val 1915561776 ecr 0,nop,wscale 7], length 0
18:38:43.315243 IP localhost.50620 > localhost.9981: Flags [S], seq 130093976, win 43690, options [mss 65495,sackOK,TS val 1915561776 ecr 0,nop,wscale 7], length 0
18:38:43.315244 IP localhost.50618 > localhost.9981: Flags [S], seq 1615277640, win 43690, options [mss 65495,sackOK,TS val 1915561776 ecr 0,nop,wscale 7], length 0
18:38:43.315245 IP localhost.50614 > localhost.9981: Flags [S], seq 3874435432, win 43690, options [mss 65495,sackOK,TS val 1915561776 ecr 0,nop,wscale 7], length 0
18:38:43.315245 IP localhost.50610 > localhost.9981: Flags [S], seq 1754417515, win 43690, options [mss 65495,sackOK,TS val 1915561776 ecr 0,nop,wscale 7], length 0
18:38:45.331216 IP localhost.50608 > localhost.9981: Flags [S], seq 2527099291, win 43690, options [mss 65495,sackOK,TS val 1915562280 ecr 0,nop,wscale 7], length 0
18:38:45.331222 IP localhost.50612 > localhost.9981: Flags [S], seq 3716483803, win 43690, options [mss 65495,sackOK,TS val 1915562280 ecr 0,nop,wscale 7], length 0
18:38:45.331223 IP localhost.50616 > localhost.9981: Flags [S], seq 2050045935, win 43690, options [mss 65495,sackOK,TS val 1915562280 ecr 0,nop,wscale 7], length 0
18:38:45.331224 IP localhost.50622 > localhost.9981: Flags [S], seq 3208585581, win 43690, options [mss 65495,sackOK,TS val 1915562280 ecr 0,nop,wscale 7], length 0
18:38:45.331225 IP localhost.50626 > localhost.9981: Flags [S], seq 1688054, win 43690, options [mss 65495,sackOK,TS val 1915562280 ecr 0,nop,wscale 7], length 0
18:38:45.331226 IP localhost.50628 > localhost.9981: Flags [S], seq 3019799743, win 43690, options [mss 65495,sackOK,TS val 1915562280 ecr 0,nop,wscale 7], length 0
18:38:45.331227 IP localhost.50630 > localhost.9981: Flags [S], seq 1866497372, win 43690, options [mss 65495,sackOK,TS val 1915562280 ecr 0,nop,wscale 7], length 0
18:38:45.331232 IP localhost.50610 > localhost.9981: Flags [S], seq 1754417515, win 43690, options [mss 65495,sackOK,TS val 1915562280 ecr 0,nop,wscale 7], length 0
18:38:45.331235 IP localhost.50614 > localhost.9981: Flags [S], seq 3874435432, win 43690, options [mss 65495,sackOK,TS val 1915562280 ecr 0,nop,wscale 7], length 0
18:38:45.331236 IP localhost.50618 > localhost.9981: Flags [S], seq 1615277640, win 43690, options [mss 65495,sackOK,TS val 1915562280 ecr 0,nop,wscale 7], length 0
18:38:45.331237 IP localhost.50620 > localhost.9981: Flags [S], seq 130093976, win 43690, options [mss 65495,sackOK,TS val 1915562280 ecr 0,nop,wscale 7], length 0
18:38:45.331238 IP localhost.50624 > localhost.9981: Flags [S], seq 3689160601, win 43690, options [mss 65495,sackOK,TS val 1915562280 ecr 0,nop,wscale 7], length 0
18:38:45.331239 IP localhost.50632 > localhost.9981: Flags [S], seq 1780106427, win 43690, options [mss 65495,sackOK,TS val 1915562280 ecr 0,nop,wscale 7], length 0
18:38:45.331240 IP localhost.50634 > localhost.9981: Flags [S], seq 418358429, win 43690, options [mss 65495,sackOK,TS val 1915562280 ecr 0,nop,wscale 7], length 0
18:38:45.331241 IP localhost.50636 > localhost.9981: Flags [S], seq 4193812533, win 43690, options [mss 65495,sackOK,TS val 1915562280 ecr 0,nop,wscale 7], length 0
18:38:45.331241 IP localhost.50638 > localhost.9981: Flags [S], seq 2628719091, win 43690, options [mss 65495,sackOK,TS val 1915562280 ecr 0,nop,wscale 7], length 0
18:38:45.331242 IP localhost.50640 > localhost.9981: Flags [S], seq 2393789709, win 43690, options [mss 65495,sackOK,TS val 1915562280 ecr 0,nop,wscale 7], length 0
18:38:45.331243 IP localhost.50642 > localhost.9981: Flags [S], seq 3338483857, win 43690, options [mss 65495,sackOK,TS val 1915562280 ecr 0,nop,wscale 7], length 0
18:38:45.331244 IP localhost.50644 > localhost.9981: Flags [S], seq 517575913, win 43690, options [mss 65495,sackOK,TS val 1915562280 ecr 0,nop,wscale 7], length 0
18:38:45.331244 IP localhost.50646 > localhost.9981: Flags [S], seq 894680662, win 43690, options [mss 65495,sackOK,TS val 1915562280 ecr 0,nop,wscale 7], length 0
18:38:49.363218 IP localhost.50630 > localhost.9981: Flags [S], seq 1866497372, win 43690, options [mss 65495,sackOK,TS val 1915563288 ecr 0,nop,wscale 7], length 0
18:38:49.363224 IP localhost.50628 > localhost.9981: Flags [S], seq 3019799743, win 43690, options [mss 65495,sackOK,TS val 1915563288 ecr 0,nop,wscale 7], length 0
18:38:49.363225 IP localhost.50626 > localhost.9981: Flags [S], seq 1688054, win 43690, options [mss 65495,sackOK,TS val 1915563288 ecr 0,nop,wscale 7], length 0
18:38:49.363226 IP localhost.50622 > localhost.9981: Flags [S], seq 3208585581, win 43690, options [mss 65495,sackOK,TS val 1915563288 ecr 0,nop,wscale 7], length 0
18:38:49.363226 IP localhost.50616 > localhost.9981: Flags [S], seq 2050045935, win 43690, options [mss 65495,sackOK,TS val 1915563288 ecr 0,nop,wscale 7], length 0
18:38:49.363227 IP localhost.50612 > localhost.9981: Flags [S], seq 3716483803, win 43690, options [mss 65495,sackOK,TS val 1915563288 ecr 0,nop,wscale 7], length 0
18:38:49.363228 IP localhost.50608 > localhost.9981: Flags [S], seq 2527099291, win 43690, options [mss 65495,sackOK,TS val 1915563288 ecr 0,nop,wscale 7], length 0
18:38:49.363234 IP localhost.50646 > localhost.9981: Flags [S], seq 894680662, win 43690, options [mss 65495,sackOK,TS val 1915563288 ecr 0,nop,wscale 7], length 0
18:38:49.363237 IP localhost.50644 > localhost.9981: Flags [S], seq 517575913, win 43690, options [mss 65495,sackOK,TS val 1915563288 ecr 0,nop,wscale 7], length 0
18:38:49.363238 IP localhost.50642 > localhost.9981: Flags [S], seq 3338483857, win 43690, options [mss 65495,sackOK,TS val 1915563288 ecr 0,nop,wscale 7], length 0
18:38:49.363239 IP localhost.50640 > localhost.9981: Flags [S], seq 2393789709, win 43690, options [mss 65495,sackOK,TS val 1915563288 ecr 0,nop,wscale 7], length 0
18:38:49.363239 IP localhost.50638 > localhost.9981: Flags [S], seq 2628719091, win 43690, options [mss 65495,sackOK,TS val 1915563288 ecr 0,nop,wscale 7], length 0
18:38:49.363240 IP localhost.50636 > localhost.9981: Flags [S], seq 4193812533, win 43690, options [mss 65495,sackOK,TS val 1915563288 ecr 0,nop,wscale 7], length 0
18:38:49.363241 IP localhost.50634 > localhost.9981: Flags [S], seq 418358429, win 43690, options [mss 65495,sackOK,TS val 1915563288 ecr 0,nop,wscale 7], length 0
18:38:49.363242 IP localhost.50632 > localhost.9981: Flags [S], seq 1780106427, win 43690, options [mss 65495,sackOK,TS val 1915563288 ecr 0,nop,wscale 7], length 0
18:38:49.363243 IP localhost.50624 > localhost.9981: Flags [S], seq 3689160601, win 43690, options [mss 65495,sackOK,TS val 1915563288 ecr 0,nop,wscale 7], length 0
18:38:49.363243 IP localhost.50620 > localhost.9981: Flags [S], seq 130093976, win 43690, options [mss 65495,sackOK,TS val 1915563288 ecr 0,nop,wscale 7], length 0
18:38:49.363244 IP localhost.50618 > localhost.9981: Flags [S], seq 1615277640, win 43690, options [mss 65495,sackOK,TS val 1915563288 ecr 0,nop,wscale 7], length 0
18:38:49.363245 IP localhost.50614 > localhost.9981: Flags [S], seq 3874435432, win 43690, options [mss 65495,sackOK,TS val 1915563288 ecr 0,nop,wscale 7], length 0
18:38:49.363246 IP localhost.50610 > localhost.9981: Flags [S], seq 1754417515, win 43690, options [mss 65495,sackOK,TS val 1915563288 ecr 0,nop,wscale 7], length 0
18:38:53.868243 IP localhost.41576 > draculet-ThinkPad-E470c.domain: 30299+ A? clients1.google.com. (37)
18:38:53.868296 IP draculet-ThinkPad-E470c.domain > localhost.41576: 30299 Refused 0/0/0 (37)
18:38:53.868327 IP localhost.44298 > draculet-ThinkPad-E470c.domain: 30299+ A? clients1.google.com. (37)
18:38:53.868346 IP draculet-ThinkPad-E470c.domain > localhost.44298: 30299 Refused 0/0/0 (37)
18:38:53.868370 IP localhost.35694 > draculet-ThinkPad-E470c.domain: 40166+ A? clients1.google.com. (37)
18:38:53.868385 IP draculet-ThinkPad-E470c.domain > localhost.35694: 40166 Refused 0/0/0 (37)
18:38:53.868403 IP localhost.55353 > draculet-ThinkPad-E470c.domain: 40166+ A? clients1.google.com. (37)
18:38:53.868417 IP draculet-ThinkPad-E470c.domain > localhost.55353: 40166 Refused 0/0/0 (37)
18:38:56.266473 IP localhost.52633 > draculet-ThinkPad-E470c.domain: 10132+ A? clients1.google.com. (37)
18:38:56.266523 IP draculet-ThinkPad-E470c.domain > localhost.52633: 10132 Refused 0/0/0 (37)
18:38:56.266556 IP localhost.52168 > draculet-ThinkPad-E470c.domain: 10132+ A? clients1.google.com. (37)
18:38:56.266576 IP draculet-ThinkPad-E470c.domain > localhost.52168: 10132 Refused 0/0/0 (37)
18:38:56.266601 IP localhost.33836 > draculet-ThinkPad-E470c.domain: 13436+ A? clients1.google.com. (37)
18:38:56.266617 IP draculet-ThinkPad-E470c.domain > localhost.33836: 13436 Refused 0/0/0 (37)
18:38:56.266634 IP localhost.58050 > draculet-ThinkPad-E470c.domain: 13436+ A? clients1.google.com. (37)
18:38:56.266649 IP draculet-ThinkPad-E470c.domain > localhost.58050: 13436 Refused 0/0/0 (37)
18:38:57.555222 IP localhost.50608 > localhost.9981: Flags [S], seq 2527099291, win 43690, options [mss 65495,sackOK,TS val 1915565336 ecr 0,nop,wscale 7], length 0
18:38:57.555227 IP localhost.50612 > localhost.9981: Flags [S], seq 3716483803, win 43690, options [mss 65495,sackOK,TS val 1915565336 ecr 0,nop,wscale 7], length 0
18:38:57.555228 IP localhost.50616 > localhost.9981: Flags [S], seq 2050045935, win 43690, options [mss 65495,sackOK,TS val 1915565336 ecr 0,nop,wscale 7], length 0
18:38:57.555229 IP localhost.50622 > localhost.9981: Flags [S], seq 3208585581, win 43690, options [mss 65495,sackOK,TS val 1915565336 ecr 0,nop,wscale 7], length 0
18:38:57.555230 IP localhost.50626 > localhost.9981: Flags [S], seq 1688054, win 43690, options [mss 65495,sackOK,TS val 1915565336 ecr 0,nop,wscale 7], length 0
18:38:57.555231 IP localhost.50628 > localhost.9981: Flags [S], seq 3019799743, win 43690, options [mss 65495,sackOK,TS val 1915565336 ecr 0,nop,wscale 7], length 0
18:38:57.555232 IP localhost.50630 > localhost.9981: Flags [S], seq 1866497372, win 43690, options [mss 65495,sackOK,TS val 1915565336 ecr 0,nop,wscale 7], length 0
18:38:57.555236 IP localhost.50610 > localhost.9981: Flags [S], seq 1754417515, win 43690, options [mss 65495,sackOK,TS val 1915565336 ecr 0,nop,wscale 7], length 0
18:38:57.555239 IP localhost.50614 > localhost.9981: Flags [S], seq 3874435432, win 43690, options [mss 65495,sackOK,TS val 1915565336 ecr 0,nop,wscale 7], length 0
18:38:57.555240 IP localhost.50618 > localhost.9981: Flags [S], seq 1615277640, win 43690, options [mss 65495,sackOK,TS val 1915565336 ecr 0,nop,wscale 7], length 0
18:38:57.555241 IP localhost.50620 > localhost.9981: Flags [S], seq 130093976, win 43690, options [mss 65495,sackOK,TS val 1915565336 ecr 0,nop,wscale 7], length 0
18:38:57.555242 IP localhost.50624 > localhost.9981: Flags [S], seq 3689160601, win 43690, options [mss 65495,sackOK,TS val 1915565336 ecr 0,nop,wscale 7], length 0
18:38:57.555243 IP localhost.50632 > localhost.9981: Flags [S], seq 1780106427, win 43690, options [mss 65495,sackOK,TS val 1915565336 ecr 0,nop,wscale 7], length 0
18:38:57.555244 IP localhost.50634 > localhost.9981: Flags [S], seq 418358429, win 43690, options [mss 65495,sackOK,TS val 1915565336 ecr 0,nop,wscale 7], length 0
18:38:57.555244 IP localhost.50636 > localhost.9981: Flags [S], seq 4193812533, win 43690, options [mss 65495,sackOK,TS val 1915565336 ecr 0,nop,wscale 7], length 0
18:38:57.555245 IP localhost.50638 > localhost.9981: Flags [S], seq 2628719091, win 43690, options [mss 65495,sackOK,TS val 1915565336 ecr 0,nop,wscale 7], length 0
18:38:57.555246 IP localhost.50640 > localhost.9981: Flags [S], seq 2393789709, win 43690, options [mss 65495,sackOK,TS val 1915565336 ecr 0,nop,wscale 7], length 0
18:38:57.555247 IP localhost.50642 > localhost.9981: Flags [S], seq 3338483857, win 43690, options [mss 65495,sackOK,TS val 1915565336 ecr 0,nop,wscale 7], length 0
18:38:57.555247 IP localhost.50644 > localhost.9981: Flags [S], seq 517575913, win 43690, options [mss 65495,sackOK,TS val 1915565336 ecr 0,nop,wscale 7], length 0
18:38:57.555248 IP localhost.50646 > localhost.9981: Flags [S], seq 894680662, win 43690, options [mss 65495,sackOK,TS val 1915565336 ecr 0,nop,wscale 7], length 0
18:38:57.672170 IP localhost.37319 > draculet-ThinkPad-E470c.domain: 49556+ A? clients1.google.com. (37)
18:38:57.672220 IP draculet-ThinkPad-E470c.domain > localhost.37319: 49556 Refused 0/0/0 (37)
18:38:57.672264 IP localhost.52093 > draculet-ThinkPad-E470c.domain: 49556+ A? clients1.google.com. (37)
18:38:57.672282 IP draculet-ThinkPad-E470c.domain > localhost.52093: 49556 Refused 0/0/0 (37)
18:38:57.672307 IP localhost.52466 > draculet-ThinkPad-E470c.domain: 12853+ A? clients1.google.com. (37)
18:38:57.672321 IP draculet-ThinkPad-E470c.domain > localhost.52466: 12853 Refused 0/0/0 (37)
18:38:57.672338 IP localhost.41633 > draculet-ThinkPad-E470c.domain: 12853+ A? clients1.google.com. (37)
18:38:57.672351 IP draculet-ThinkPad-E470c.domain > localhost.41633: 12853 Refused 0/0/0 (37)
18:38:57.674190 IP localhost.34807 > draculet-ThinkPad-E470c.domain: 16588+ A? clients1.google.com. (37)
18:38:57.674218 IP draculet-ThinkPad-E470c.domain > localhost.34807: 16588 Refused 0/0/0 (37)
18:38:57.674242 IP localhost.41186 > draculet-ThinkPad-E470c.domain: 16588+ A? clients1.google.com. (37)
18:38:57.674256 IP draculet-ThinkPad-E470c.domain > localhost.41186: 16588 Refused 0/0/0 (37)
18:38:57.674276 IP localhost.40650 > draculet-ThinkPad-E470c.domain: 6488+ A? clients1.google.com. (37)
18:38:57.674289 IP draculet-ThinkPad-E470c.domain > localhost.40650: 6488 Refused 0/0/0 (37)
18:38:57.674305 IP localhost.46267 > draculet-ThinkPad-E470c.domain: 6488+ A? clients1.google.com. (37)
18:38:57.674318 IP draculet-ThinkPad-E470c.domain > localhost.46267: 6488 Refused 0/0/0 (37)
18:38:57.676215 IP localhost.45482 > draculet-ThinkPad-E470c.domain: 38148+ A? clients1.google.com. (37)
18:38:57.676246 IP draculet-ThinkPad-E470c.domain > localhost.45482: 38148 Refused 0/0/0 (37)
18:38:57.676355 IP localhost.45645 > draculet-ThinkPad-E470c.domain: 38148+ A? clients1.google.com. (37)
18:38:57.676374 IP draculet-ThinkPad-E470c.domain > localhost.45645: 38148 Refused 0/0/0 (37)
18:38:57.676504 IP localhost.56941 > draculet-ThinkPad-E470c.domain: 37681+ A? clients1.google.com. (37)
18:38:57.676520 IP draculet-ThinkPad-E470c.domain > localhost.56941: 37681 Refused 0/0/0 (37)
18:38:57.676538 IP localhost.51114 > draculet-ThinkPad-E470c.domain: 37681+ A? clients1.google.com. (37)
18:38:57.676551 IP draculet-ThinkPad-E470c.domain > localhost.51114: 37681 Refused 0/0/0 (37)
18:38:57.676908 IP localhost.56213 > draculet-ThinkPad-E470c.domain: 44421+ A? clients1.google.com. (37)
18:38:57.676930 IP draculet-ThinkPad-E470c.domain > localhost.56213: 44421 Refused 0/0/0 (37)
18:38:57.677002 IP localhost.57952 > draculet-ThinkPad-E470c.domain: 44421+ A? clients1.google.com. (37)
18:38:57.677018 IP draculet-ThinkPad-E470c.domain > localhost.57952: 44421 Refused 0/0/0 (37)
18:38:57.677181 IP localhost.47229 > draculet-ThinkPad-E470c.domain: 35133+ A? clients1.google.com. (37)
18:38:57.677199 IP draculet-ThinkPad-E470c.domain > localhost.47229: 35133 Refused 0/0/0 (37)
18:38:57.677218 IP localhost.51034 > draculet-ThinkPad-E470c.domain: 35133+ A? clients1.google.com. (37)
18:38:57.677231 IP draculet-ThinkPad-E470c.domain > localhost.51034: 35133 Refused 0/0/0 (37)
18:38:57.678090 IP localhost.41605 > draculet-ThinkPad-E470c.domain: 41050+ A? clients1.google.com. (37)
18:38:57.678119 IP draculet-ThinkPad-E470c.domain > localhost.41605: 41050 Refused 0/0/0 (37)
18:38:57.678176 IP localhost.44372 > draculet-ThinkPad-E470c.domain: 41050+ A? clients1.google.com. (37)
18:38:57.678192 IP draculet-ThinkPad-E470c.domain > localhost.44372: 41050 Refused 0/0/0 (37)
18:38:57.678213 IP localhost.54649 > draculet-ThinkPad-E470c.domain: 16266+ A? clients1.google.com. (37)
18:38:57.678226 IP draculet-ThinkPad-E470c.domain > localhost.54649: 16266 Refused 0/0/0 (37)
18:38:57.678243 IP localhost.58289 > draculet-ThinkPad-E470c.domain: 16266+ A? clients1.google.com. (37)
18:38:57.678256 IP draculet-ThinkPad-E470c.domain > localhost.58289: 16266 Refused 0/0/0 (37)
18:38:57.678543 IP localhost.47526 > draculet-ThinkPad-E470c.domain: 3476+ A? clients1.google.com. (37)
18:38:57.678563 IP draculet-ThinkPad-E470c.domain > localhost.47526: 3476 Refused 0/0/0 (37)
18:38:57.678584 IP localhost.48074 > draculet-ThinkPad-E470c.domain: 3476+ A? clients1.google.com. (37)
18:38:57.678598 IP draculet-ThinkPad-E470c.domain > localhost.48074: 3476 Refused 0/0/0 (37)
18:38:57.678617 IP localhost.41424 > draculet-ThinkPad-E470c.domain: 14859+ A? clients1.google.com. (37)
18:38:57.678630 IP draculet-ThinkPad-E470c.domain > localhost.41424: 14859 Refused 0/0/0 (37)
18:38:57.678646 IP localhost.43150 > draculet-ThinkPad-E470c.domain: 14859+ A? clients1.google.com. (37)
18:38:57.678659 IP draculet-ThinkPad-E470c.domain > localhost.43150: 14859 Refused 0/0/0 (37)
18:39:05.671453 IP localhost.49862 > draculet-ThinkPad-E470c.domain: 45142+ A? clients1.google.com. (37)
18:39:05.671595 IP draculet-ThinkPad-E470c.domain > localhost.49862: 45142 Refused 0/0/0 (37)
18:39:05.671629 IP localhost.59969 > draculet-ThinkPad-E470c.domain: 45142+ A? clients1.google.com. (37)
18:39:05.671646 IP draculet-ThinkPad-E470c.domain > localhost.59969: 45142 Refused 0/0/0 (37)
18:39:05.671670 IP localhost.41816 > draculet-ThinkPad-E470c.domain: 48631+ A? clients1.google.com. (37)
18:39:05.671685 IP draculet-ThinkPad-E470c.domain > localhost.41816: 48631 Refused 0/0/0 (37)
18:39:05.671702 IP localhost.58908 > draculet-ThinkPad-E470c.domain: 48631+ A? clients1.google.com. (37)
18:39:05.671716 IP draculet-ThinkPad-E470c.domain > localhost.58908: 48631 Refused 0/0/0 (37)
18:39:11.920618 IP localhost.54990 > draculet-ThinkPad-E470c.domain: 57112+ A? clients1.google.com. (37)
18:39:11.920662 IP draculet-ThinkPad-E470c.domain > localhost.54990: 57112 Refused 0/0/0 (37)
18:39:11.920748 IP localhost.37639 > draculet-ThinkPad-E470c.domain: 57112+ A? clients1.google.com. (37)
18:39:11.920768 IP draculet-ThinkPad-E470c.domain > localhost.37639: 57112 Refused 0/0/0 (37)
18:39:11.920791 IP localhost.42051 > draculet-ThinkPad-E470c.domain: 32826+ A? clients1.google.com. (37)
18:39:11.920805 IP draculet-ThinkPad-E470c.domain > localhost.42051: 32826 Refused 0/0/0 (37)
18:39:11.920822 IP localhost.33524 > draculet-ThinkPad-E470c.domain: 32826+ A? clients1.google.com. (37)
18:39:11.920835 IP draculet-ThinkPad-E470c.domain > localhost.33524: 32826 Refused 0/0/0 (37)
18:39:12.276129 IP localhost.45557 > draculet-ThinkPad-E470c.domain: 5445+ A? clients1.google.com. (37)
18:39:12.276176 IP draculet-ThinkPad-E470c.domain > localhost.45557: 5445 Refused 0/0/0 (37)
18:39:12.276208 IP localhost.41496 > draculet-ThinkPad-E470c.domain: 5445+ A? clients1.google.com. (37)
18:39:12.276224 IP draculet-ThinkPad-E470c.domain > localhost.41496: 5445 Refused 0/0/0 (37)
18:39:12.276270 IP localhost.59287 > draculet-ThinkPad-E470c.domain: 60349+ A? clients1.google.com. (37)
18:39:12.276285 IP draculet-ThinkPad-E470c.domain > localhost.59287: 60349 Refused 0/0/0 (37)
18:39:12.276303 IP localhost.44026 > draculet-ThinkPad-E470c.domain: 60349+ A? clients1.google.com. (37)
18:39:12.276317 IP draculet-ThinkPad-E470c.domain > localhost.44026: 60349 Refused 0/0/0 (37)
18:39:13.683217 IP localhost.50630 > localhost.9981: Flags [S], seq 1866497372, win 43690, options [mss 65495,sackOK,TS val 1915569368 ecr 0,nop,wscale 7], length 0
18:39:13.683223 IP localhost.50628 > localhost.9981: Flags [S], seq 3019799743, win 43690, options [mss 65495,sackOK,TS val 1915569368 ecr 0,nop,wscale 7], length 0
18:39:13.683224 IP localhost.50626 > localhost.9981: Flags [S], seq 1688054, win 43690, options [mss 65495,sackOK,TS val 1915569368 ecr 0,nop,wscale 7], length 0
18:39:13.683225 IP localhost.50622 > localhost.9981: Flags [S], seq 3208585581, win 43690, options [mss 65495,sackOK,TS val 1915569368 ecr 0,nop,wscale 7], length 0
18:39:13.683226 IP localhost.50616 > localhost.9981: Flags [S], seq 2050045935, win 43690, options [mss 65495,sackOK,TS val 1915569368 ecr 0,nop,wscale 7], length 0
18:39:13.683227 IP localhost.50612 > localhost.9981: Flags [S], seq 3716483803, win 43690, options [mss 65495,sackOK,TS val 1915569368 ecr 0,nop,wscale 7], length 0
18:39:13.683227 IP localhost.50608 > localhost.9981: Flags [S], seq 2527099291, win 43690, options [mss 65495,sackOK,TS val 1915569368 ecr 0,nop,wscale 7], length 0
18:39:13.683232 IP localhost.50646 > localhost.9981: Flags [S], seq 894680662, win 43690, options [mss 65495,sackOK,TS val 1915569368 ecr 0,nop,wscale 7], length 0
18:39:13.683235 IP localhost.50644 > localhost.9981: Flags [S], seq 517575913, win 43690, options [mss 65495,sackOK,TS val 1915569368 ecr 0,nop,wscale 7], length 0
18:39:13.683236 IP localhost.50642 > localhost.9981: Flags [S], seq 3338483857, win 43690, options [mss 65495,sackOK,TS val 1915569368 ecr 0,nop,wscale 7], length 0
18:39:13.683237 IP localhost.50640 > localhost.9981: Flags [S], seq 2393789709, win 43690, options [mss 65495,sackOK,TS val 1915569368 ecr 0,nop,wscale 7], length 0
18:39:13.683237 IP localhost.50638 > localhost.9981: Flags [S], seq 2628719091, win 43690, options [mss 65495,sackOK,TS val 1915569368 ecr 0,nop,wscale 7], length 0
18:39:13.683238 IP localhost.50636 > localhost.9981: Flags [S], seq 4193812533, win 43690, options [mss 65495,sackOK,TS val 1915569368 ecr 0,nop,wscale 7], length 0
18:39:13.683239 IP localhost.50634 > localhost.9981: Flags [S], seq 418358429, win 43690, options [mss 65495,sackOK,TS val 1915569368 ecr 0,nop,wscale 7], length 0
18:39:13.683240 IP localhost.50632 > localhost.9981: Flags [S], seq 1780106427, win 43690, options [mss 65495,sackOK,TS val 1915569368 ecr 0,nop,wscale 7], length 0
18:39:13.683241 IP localhost.50624 > localhost.9981: Flags [S], seq 3689160601, win 43690, options [mss 65495,sackOK,TS val 1915569368 ecr 0,nop,wscale 7], length 0
18:39:13.683241 IP localhost.50620 > localhost.9981: Flags [S], seq 130093976, win 43690, options [mss 65495,sackOK,TS val 1915569368 ecr 0,nop,wscale 7], length 0
18:39:13.683242 IP localhost.50618 > localhost.9981: Flags [S], seq 1615277640, win 43690, options [mss 65495,sackOK,TS val 1915569368 ecr 0,nop,wscale 7], length 0
18:39:13.683243 IP localhost.50614 > localhost.9981: Flags [S], seq 3874435432, win 43690, options [mss 65495,sackOK,TS val 1915569368 ecr 0,nop,wscale 7], length 0
18:39:13.683244 IP localhost.50610 > localhost.9981: Flags [S], seq 1754417515, win 43690, options [mss 65495,sackOK,TS val 1915569368 ecr 0,nop,wscale 7], length 0
18:39:23.871253 IP localhost.40988 > draculet-ThinkPad-E470c.domain: 28898+ A? clients1.google.com. (37)
18:39:23.871306 IP draculet-ThinkPad-E470c.domain > localhost.40988: 28898 Refused 0/0/0 (37)
18:39:23.871338 IP localhost.44694 > draculet-ThinkPad-E470c.domain: 28898+ A? clients1.google.com. (37)
18:39:23.871355 IP draculet-ThinkPad-E470c.domain > localhost.44694: 28898 Refused 0/0/0 (37)
18:39:23.871378 IP localhost.33193 > draculet-ThinkPad-E470c.domain: 56982+ A? clients1.google.com. (37)
18:39:23.871393 IP draculet-ThinkPad-E470c.domain > localhost.33193: 56982 Refused 0/0/0 (37)
18:39:23.871410 IP localhost.48122 > draculet-ThinkPad-E470c.domain: 56982+ A? clients1.google.com. (37)
18:39:23.871424 IP draculet-ThinkPad-E470c.domain > localhost.48122: 56982 Refused 0/0/0 (37)
18:39:26.268372 IP localhost.58331 > draculet-ThinkPad-E470c.domain: 47935+ A? clients1.google.com. (37)
18:39:26.268419 IP draculet-ThinkPad-E470c.domain > localhost.58331: 47935 Refused 0/0/0 (37)
18:39:26.268451 IP localhost.43120 > draculet-ThinkPad-E470c.domain: 47935+ A? clients1.google.com. (37)
18:39:26.268468 IP draculet-ThinkPad-E470c.domain > localhost.43120: 47935 Refused 0/0/0 (37)
18:39:26.268491 IP localhost.56167 > draculet-ThinkPad-E470c.domain: 32583+ A? clients1.google.com. (37)
18:39:26.268505 IP draculet-ThinkPad-E470c.domain > localhost.56167: 32583 Refused 0/0/0 (37)
18:39:26.268521 IP localhost.40245 > draculet-ThinkPad-E470c.domain: 32583+ A? clients1.google.com. (37)
18:39:26.268534 IP draculet-ThinkPad-E470c.domain > localhost.40245: 32583 Refused 0/0/0 (37)
18:39:27.673880 IP localhost.58136 > draculet-ThinkPad-E470c.domain: 28572+ A? clients1.google.com. (37)
18:39:27.673928 IP draculet-ThinkPad-E470c.domain > localhost.58136: 28572 Refused 0/0/0 (37)
18:39:27.673960 IP localhost.50439 > draculet-ThinkPad-E470c.domain: 28572+ A? clients1.google.com. (37)
18:39:27.673977 IP draculet-ThinkPad-E470c.domain > localhost.50439: 28572 Refused 0/0/0 (37)
18:39:27.673999 IP localhost.54960 > draculet-ThinkPad-E470c.domain: 53592+ A? clients1.google.com. (37)
18:39:27.674013 IP draculet-ThinkPad-E470c.domain > localhost.54960: 53592 Refused 0/0/0 (37)
18:39:27.674029 IP localhost.54768 > draculet-ThinkPad-E470c.domain: 53592+ A? clients1.google.com. (37)
18:39:27.674042 IP draculet-ThinkPad-E470c.domain > localhost.54768: 53592 Refused 0/0/0 (37)
18:39:27.675906 IP localhost.34285 > draculet-ThinkPad-E470c.domain: 64191+ A? clients1.google.com. (37)
18:39:27.675934 IP draculet-ThinkPad-E470c.domain > localhost.34285: 64191 Refused 0/0/0 (37)
18:39:27.675957 IP localhost.33914 > draculet-ThinkPad-E470c.domain: 64191+ A? clients1.google.com. (37)
18:39:27.675972 IP draculet-ThinkPad-E470c.domain > localhost.33914: 64191 Refused 0/0/0 (37)
18:39:27.675992 IP localhost.46134 > draculet-ThinkPad-E470c.domain: 48655+ A? clients1.google.com. (37)
18:39:27.676005 IP draculet-ThinkPad-E470c.domain > localhost.46134: 48655 Refused 0/0/0 (37)
18:39:27.676023 IP localhost.34022 > draculet-ThinkPad-E470c.domain: 48655+ A? clients1.google.com. (37)
18:39:27.676036 IP draculet-ThinkPad-E470c.domain > localhost.34022: 48655 Refused 0/0/0 (37)
18:39:27.679301 IP localhost.54285 > draculet-ThinkPad-E470c.domain: 2757+ A? clients1.google.com. (37)
18:39:27.679333 IP draculet-ThinkPad-E470c.domain > localhost.54285: 2757 Refused 0/0/0 (37)
18:39:27.679385 IP localhost.34199 > draculet-ThinkPad-E470c.domain: 2757+ A? clients1.google.com. (37)
18:39:27.679404 IP draculet-ThinkPad-E470c.domain > localhost.34199: 2757 Refused 0/0/0 (37)
18:39:27.679432 IP localhost.54048 > draculet-ThinkPad-E470c.domain: 21387+ A? clients1.google.com. (37)
18:39:27.679446 IP draculet-ThinkPad-E470c.domain > localhost.54048: 21387 Refused 0/0/0 (37)
18:39:27.679603 IP localhost.46300 > draculet-ThinkPad-E470c.domain: 21387+ A? clients1.google.com. (37)
18:39:27.679620 IP draculet-ThinkPad-E470c.domain > localhost.46300: 21387 Refused 0/0/0 (37)
18:39:27.679757 IP localhost.39309 > draculet-ThinkPad-E470c.domain: 12069+ A? clients1.google.com. (37)
18:39:27.679775 IP draculet-ThinkPad-E470c.domain > localhost.39309: 12069 Refused 0/0/0 (37)
18:39:27.679793 IP localhost.40382 > draculet-ThinkPad-E470c.domain: 12069+ A? clients1.google.com. (37)
18:39:27.679806 IP draculet-ThinkPad-E470c.domain > localhost.40382: 12069 Refused 0/0/0 (37)
18:39:27.679825 IP localhost.36569 > draculet-ThinkPad-E470c.domain: 17149+ A? clients1.google.com. (37)
18:39:27.679838 IP draculet-ThinkPad-E470c.domain > localhost.36569: 17149 Refused 0/0/0 (37)
18:39:27.679894 IP localhost.59412 > draculet-ThinkPad-E470c.domain: 17149+ A? clients1.google.com. (37)
18:39:27.679909 IP draculet-ThinkPad-E470c.domain > localhost.59412: 17149 Refused 0/0/0 (37)
18:39:27.680531 IP localhost.45035 > draculet-ThinkPad-E470c.domain: 32585+ A? clients1.google.com. (37)
18:39:27.680555 IP draculet-ThinkPad-E470c.domain > localhost.45035: 32585 Refused 0/0/0 (37)
18:39:27.680577 IP localhost.60563 > draculet-ThinkPad-E470c.domain: 32585+ A? clients1.google.com. (37)
18:39:27.680590 IP draculet-ThinkPad-E470c.domain > localhost.60563: 32585 Refused 0/0/0 (37)
18:39:27.680611 IP localhost.53091 > draculet-ThinkPad-E470c.domain: 63229+ A? clients1.google.com. (37)
18:39:27.680624 IP draculet-ThinkPad-E470c.domain > localhost.53091: 63229 Refused 0/0/0 (37)
18:39:27.680641 IP localhost.54673 > draculet-ThinkPad-E470c.domain: 63229+ A? clients1.google.com. (37)
18:39:27.680654 IP draculet-ThinkPad-E470c.domain > localhost.54673: 63229 Refused 0/0/0 (37)
18:39:27.681333 IP localhost.46940 > draculet-ThinkPad-E470c.domain: 59304+ A? clients1.google.com. (37)
18:39:27.681360 IP draculet-ThinkPad-E470c.domain > localhost.46940: 59304 Refused 0/0/0 (37)
18:39:27.681388 IP localhost.34766 > draculet-ThinkPad-E470c.domain: 59304+ A? clients1.google.com. (37)
18:39:27.681404 IP draculet-ThinkPad-E470c.domain > localhost.34766: 59304 Refused 0/0/0 (37)
18:39:27.681438 IP localhost.41932 > draculet-ThinkPad-E470c.domain: 54393+ A? clients1.google.com. (37)
18:39:27.681452 IP draculet-ThinkPad-E470c.domain > localhost.41932: 54393 Refused 0/0/0 (37)
18:39:27.681471 IP localhost.49503 > draculet-ThinkPad-E470c.domain: 54393+ A? clients1.google.com. (37)
18:39:27.681484 IP draculet-ThinkPad-E470c.domain > localhost.49503: 54393 Refused 0/0/0 (37)
